title,content,url,sub_title,year
Protection to homologous and heterologous challenge in pigs immunized with vaccine against foot-and-mouth disease type O caused an epidemic in East Asia during …,"… vaccine strains were identified in six amino acids by complete genome sequencing. … 
Situations in which animals are protected even when the levels of antibodies are low may be 
… In our experiment, animals vaccinated with 2 or 5 μg of 146S antigens partially produced …",https://www.sciencedirect.com/science/article/pii/S0264410X14001194,"JN Park, SY Lee, JQ Chu, YJ Lee, RH Kim, KN Lee… - Vaccine, 2014 - Elsevier",2014
Whole genomes redefine the mutational landscape of pancreatic cancer,"… genomes contain widespread and complex patterns of chromosomal rearrangement 8,9 . 
Here we performed deep whole-genome sequencing of … Mouse experiments were carried out 
in compliance with Australian laws on animal welfare. Mouse protocols were approved by the …",https://www.nature.com/articles/nature14169,"N Waddell, M Pajic, AM Patch, DK Chang, KS Kassahn… - Nature, 2015 - nature.com",2015
Resolving difficult phylogenetic questions: why more sequences are not enough,"… inference of phylogenetic relationships using genome-scale data (Box 1). Mesmerized by 
the sustained increase in sequencing throughput, many … The studies, which deal with the 
early diversification of animals, produced highly incongruent (Box 2) findings despite the use of …",https://journals.plos.org/plosbiology/article?id=10.1371/journal.pbio.1000602,"H Philippe, H Brinkmann, DV Lavrov… - PLoS …, 2011 - journals.plos.org",2011
Mitochondrial genomes of parasitic arthropods: implications for studies of population genetics and evolution,"… animals (hereafter animals), this process has led to mt genomes that are about 16 kb long 
and encode, typically, 13 proteins, 2 rRNA subunits and 22 tRNAs. The mt genomes of animals 
… sequence whereas only 7% of the nuclear genome of this mosquito is coding sequence (…",https://www.cambridge.org/core/journals/parasitology/article/mitochondrial-genomes-of-parasitic-arthropods-implications-for-studies-of-population-genetics-and-evolution/CEF0FCEC8E5C1B47A8B8372EBB802694,"R Shao, SC Barker - Parasitology, 2007 - cambridge.org",2007
Multiple genomic signatures of selection in goats and sheep indigenous to a hot arid environment,"… score phenotypic differences between animals) and refine our results by integrating 
comprehensive genomic data (for example, candidate gene sequencing, high density SNP … 
Using comparative genomics to reorder the human genome sequence into a virtual sheep genome. …",https://www.nature.com/articles/hdy201594,"ES Kim, AR Elbeltagy, AM Aboul-Naga, B Rischkowsky… - Heredity, 2016 - nature.com",2016
Repetitive DNA and next-generation sequencing: computational challenges and solutions,"… Until read lengths are greater than 500 bp, assemblies of large plant and animal genomes 
will need to use other strategies to assemble these types of repeats correctly. Even Sanger 
read lengths (800–900 bp) cannot resolve longer repeats such as LINEs (Box 1), and these will …",https://www.nature.com/articles/nrg3117,"TJ Treangen, SL Salzberg - Nature Reviews Genetics, 2012 - nature.com",2012
Aberrant methylation of donor genome in cloned bovine embryos,"… Despite recent successes in cloning various animal species, the use of somatic cells as the 
source of donor nuclei has raised many practically … We chose a CpG-rich sequence in satellite 
I region as the target (Fig. 1a). The methylation profiles of 12 CpG dinucleotides seemed …",https://www.nature.com/articles/ng0601_173,"YK Kang, DB Koo, JS Park, YH Choi, AS Chung… - Nature …, 2001 - nature.com",2001
Efficient genome modification by CRISPR-Cas9 nickase with minimal off-target effects,"… generate sizeable deletions in the genome at a high efficiency. Finally, we observed no 
detectable damage in the founder animals at two off-… The scan is made suitably efficient by 
streaming the genome sequence, and using bitwise (rapid) operations to check for the number of …",https://www.nature.com/articles/nmeth.2857,"B Shen, W Zhang, J Zhang, J Zhou, J Wang, L Chen… - Nature …, 2014 - nature.com",2014
Populus: A Model System for Plant Biology,"… map with the genome sequence. Finally, polymorphic microsatellite genetic markers 
anchored 335 Mb of genome sequence to the 19 … As an ecologically dominant tree, Populus 
is subject to herbivory by a variety of animals. Although browsing of Populus by mammals is …",https://www.annualreviews.org/doi/abs/10.1146/annurev.arplant.58.032806.103956,"S Jansson, CJ Douglas - Annu. Rev. Plant Biol., 2007 - annualreviews.org",2007
Microbe domestication and the identification of the wild genetic stock of lager-brewing yeast,"… Domestication of plants and animals promoted humanity's transition from nomadic to sedentary 
lifestyles, demographic expansion, and … The draft genome sequence of S. eubayanus is 
99.5% identical to the non-S. cerevisiae portion of the S. pastorianus genome sequence and …",https://www.pnas.org/content/108/35/14539.short,"D Libkind, CT Hittinger, E Valério… - Proceedings of the …, 2011 - National Acad Sciences",2011
Database resources of the national center for biotechnology information,"… The Plant Genomes Central Web page serves as a portal to completed plant genomes, to 
information on plant genome sequencing projects or to … Online Mendelian Inheritance in 
Animals (OMIA) is a database of genes, inherited disorders and traits in animal species, other than …",https://academic.oup.com/nar/article-abstract/36/suppl_1/D13/2505763,"DL Wheeler, T Barrett, DA Benson… - Nucleic acids …, 2007 - academic.oup.com",2007
"Reference sequence (RefSeq) database at NCBI: current status, taxonomic expansion, and functional annotation","… The majority of plant, animal, insect and arthropod genomes are annotated by the eukaryotic 
genome annotation pipeline. This pipeline … For plants, we strive to provide a curated transcript 
and protein dataset that is consistent with the cultivar selected for genome sequencing …",https://academic.oup.com/nar/article-abstract/44/D1/D733/2502674,"NA O'Leary, MW Wright, JR Brister, S Ciufo… - Nucleic acids …, 2016 - academic.oup.com",2016
Population genomics of ungulates,"… Most genome sequencing projects to date have been concentrated on model or domestic 
species. With the improvement and lowered cost … Ungulate research has benefited from 
genome projects on domestic animals more so than most other taxonomic groups. Resources like …",https://link.springer.com/chapter/10.1007/13836_2018_30,"D Martchenko, E Prewer, EK Latch, CJ Kyle… - Population Genomics …, 2018 - Springer",2018
Hormones and animal social behavior,"… With the successful sequencing of several animal genomes and the development of new 
methods for studying the involvement of multiple … This book about the role of steroid hormones 
in the social life of animals is motivated by the belief that further progress in understanding …",https://www.degruyter.com/document/doi/10.1515/9781400850778/html,E Adkins-Regan - 2013 - degruyter.com,0
CRISPR/Cas9 in genome editing and beyond,"… However, the majority of the human genome sequence lacks unique binding proteins. 
For this reason, the use of programmable DNA-… Microinjection of purified Cas9 RNP 
complexes into animal embryos successfully generated genome-edited animals (251, 252). …",https://www.annualreviews.org/doi/abs/10.1146/annurev-biochem-060815-014607,"H Wang, M La Russa, LS Qi - Annual review of biochemistry, 2016 - annualreviews.org",2016
Endosymbiotic gene transfer: organelle genomes forge eukaryotic chromosomes,"… are also present in the nuclear genomes of most eukaryotic species. Genome sequencing 
projects have now uncovered abundant organelle-… The deletion and functional replacement 
of mitochondrial genes by nuclear copies has effectively stopped in higher animals 47 in which …",https://www.nature.com/articles/nrg1271,"JN Timmis, MA Ayliffe, CY Huang, W Martin - Nature reviews genetics, 2004 - nature.com",2004
Chromosome 21 and down syndrome: from genomics to pathophysiology,"… Animal models combined with genome-wide analytical methods have proved indispensable 
for … genomics has had on our understanding of the 'disorders of the genome'. We discuss the 
recent advances in genome sequencing, comparative genome analysis, functional genome …",https://www.nature.com/articles/nrg1448,"SE Antonarakis, R Lyle, ET Dermitzakis… - Nature reviews …, 2004 - nature.com",2004
Somatic mutation in cancer and normal cells,"… Genome sequencing has revolutionized our understanding of somatic mutation in cancer, 
providing a detailed view of the mutational … We briefly summarize a number of the lessons 
learned over 5 years of cancer genome sequencing and discuss their implications for our …",https://science.sciencemag.org/content/349/6255/1483.abstract,"I Martincorena, PJ Campbell - Science, 2015 - science.sciencemag.org",2015
Genome duplication in the teleost fish Tetraodon nigroviridis reveals the early vertebrate proto-karyotype,"… Tetraodon nigroviridis is a freshwater puffer fish with the smallest known vertebrate genome. 
Here, we report a draft genome sequence with long-range linkage and substantial anchoring 
to the 21 Tetraodon chromosomes. Genome analysis provides a greatly improved fish …",https://www.nature.com/articles/nature03025?referral=true,"O Jaillon, JM Aury, F Brunet, JL Petit… - Nature, 2004 - nature.com",2004
Comparative genomics reveals insights into avian genome evolution and adaptation,"… We annotated the protein-coding sequences using a homology-based method for all 
genomes, aided by transcriptome sequencing for some species (18). To avoid systematic 
biases related to the use of different methods in annotations of previously published avian …",https://www.science.org/doi/abs/10.1126/science.1251385,"…, Y Zhang, H Yang, J Wang, Avian Genome Consortium… - Science, 2014 - science.org",2014
Base editing: precision chemistry on the genome and transcriptome of living cells,"… Whole-genome sequencing (WGS), when performed on the genomic DNA from sufficient 
numbers of independent cells, has the potential … -edited animals have not been performed with 
sufficient power or controls to identify such events across an entire mammalian genome. Kim, …",https://www.nature.com/articles/s41576-018-0059-1,"HA Rees, DR Liu - Nature reviews genetics, 2018 - nature.com",2018
Genome-wide quantitative enhancer activity maps identified by STARR-seq,"… of enhancers in animal genomes and their genomic positions, cell-type specificity, and strengths 
are largely unknown. Arnold et al. (p. … in a direct, quantitative, and genome-wide manner, 
we developed STARR-seq (self-transcribing active regulatory region sequencing). Because …",https://science.sciencemag.org/content/339/6123/1074.abstract,"CD Arnold, D Gerlach, C Stelzer, ŁM Boryń… - …, 2013 - science.sciencemag.org",2013
"Incorporating molecular evolution into phylogenetic analysis, and a new compilation of conserved polymerase chain reaction primers for animal mitochondrial DNA","… data for a severely problematic—thus very interesting—macromolecule simply because of 
sequencing technology. In the early to mid-… sequencing machines greatly increased the rate 
of collection of DNA data. The sequencing of complete organelle and nuclear genomes has …",https://www.annualreviews.org/doi/abs/10.1146/annurev.ecolsys.37.091305.110018,"C Simon, TR Buckley, F Frati, JB Stewart… - Annu. Rev. Ecol …, 2006 - annualreviews.org",2006
The genomes of four tapeworm species reveal adaptations to parasitism,"… Synteny is maintained with distantly related blood flukes but we find extreme losses of genes 
and pathways that are ubiquitous in other animals… ), for which no genome sequence has 
been available so far. Here we present a high-quality reference tapeworm genome of a human-…",https://www.nature.com/articles/nature12031,"IJ Tsai, M Zarowiecki, N Holroyd, A Garciarrubio… - Nature, 2013 - nature.com",2013
Charting a course for genomic medicine from base pairs to bedside,"… The major bottleneck in genome sequencing is no longer data generation—the … by a vision 
that knowing the human genome sequence would be extraordinarily useful for understanding 
… cellular genome,” and he advocated sequencing “the whole genome of a selected animal …",https://www.nature.com/articles/nature09764,"ED Green, MS Guyer - Nature, 2011 - nature.com",2011
In Silico Detection and Typing of Plasmids using PlasmidFinder and Plasmid Multilocus Sequence Typing,"… -genome sequence (WGS) and whole-plasmid sequence data from members of the family 
Enterobacteriaceae. These tools will facilitate bacterial typing based on draft genomes … from 
various animals, including pigs (35). Interestingly, resistance gene analysis on the same draft …",https://journals.asm.org/doi/abs/10.1128/AAC.02412-14,"A Carattoli, E Zankari, A García-Fernández… - Antimicrobial agents …, 2014 - Am Soc Microbiol",2014
A draft sequence of the rice genome (Oryza sativa L. ssp. japonica),"… The rice genome sequence provides a foundation for the improvement of cereals, our most 
important crops. … Simple sequence repeats (SSRs) are highly polymorphic sequences found 
throughout plant and animal genomes. SSR repeat unit lengths are easily detectable and …",https://science.sciencemag.org/content/296/5565/92.abstract,"SA Goff, D Ricke, TH Lan, G Presting, R Wang… - …, 2002 - science.sciencemag.org",2002
Evidence for a core gut microbiota in the zebrafish,"… Our results complement a limited number of previous 16S rRNA gene sequence-based 
comparisons of gut microbiotas in wild and domesticated animals. Analysis of wild and domesticated 
mice (Wilson et al., 2006), turkeys (Scupham et al., 2008), parrots (Xenoulis et al., 2010), …",https://www.nature.com/articles/ismej201138,"G Roeselers, EK Mittge, WZ Stephens, DM Parichy… - The ISME …, 2011 - nature.com",2011
Evolution of mammals and their gut microbes,"… animal provenance, we represented mammalian species by multiple individuals from multiple 
locales where possible, and chose wild animals to match captive animals. … the Washington 
University Genome Sequencing Center for assistance with 16S rRNA gene sequencing; and …",https://science.sciencemag.org/content/320/5883/1647.abstract,"RE Ley, M Hamady, C Lozupone, PJ Turnbaugh… - …, 2008 - science.sciencemag.org",2008
"Novel orthobunyavirus in cattle, Europe, 2011","… animal from a different farm (Table, BH 81/11). For metagenomic analysis, 4 sequencing libraries 
(Table) were prepared and sequenced by using the 454 Genome … By using a combination 
of BLAST (1) and sequence mapping with the 454 reference mapper application (version …",https://www.ncbi.nlm.nih.gov/pmc/articles/PMC3309600/,"B Hoffmann, M Scheuch, D Höper… - Emerging infectious …, 2012 - ncbi.nlm.nih.gov",2012
The genome of the green anole lizard and a comparative analysis with birds and mammals,"… Here we report the genome sequence of the North American green anole lizard, Anolis … 
carolinensis genome sequence as a representative of non-avian reptiles, Anolis species … 
evolution in a land animal 26 ; in particular because anole genomes contain large numbers of active …",https://www.nature.com/articles/nature10390,"J Alföldi, F Di Palma, M Grabherr, C Williams, L Kong… - Nature, 2011 - nature.com",2011
From gene trees to organismal phylogeny in prokaryotes: the case of the γ-Proteobacteria,"… as well as pathogens and intracellular symbionts of plants and animals. We propose an 
approach to multigene phylogeny using complete … By demonstrating the potential to establish 
robust organismal phylogenies using genome sequence data, our results provide a foundation …",https://journals.plos.org/plosbiology/article?id=10.1371/journal.pbio.0000019,"E Lerat, V Daubin, NA Moran, D Penny - PLoS biology, 2003 - journals.plos.org",2003
TarBase: A comprehensive database of experimentally supported animal microRNA targets,"… The specific target sites within the target gene are linked to UCSC Genome Browser via 
custom tracks for facile viewing of their genic location and sequence composition. Finally, 
each target site is also linked to an in-house database of all known miRNA:target site base-pairing …",https://rnajournal.cshlp.org/content/12/2/192.short,"P Sethupathy, B Corda, AG Hatzigeorgiou - Rna, 2006 - rnajournal.cshlp.org",2006
Isolation of a novel coronavirus from a man with pneumonia in Saudi Arabia,"… acute respiratory syndrome (SARS) outbreak in 2003 and reminds us that animal 
coronaviruses can cause severe disease in humans. … They may cause respiratory, enteric, 
hepatic, or neurologic diseases, with variable severity in various animal species. In humans, four …",https://www.nejm.org/doi/full/10.1056/nejmoa1211721,"AM Zaki, S Van Boheemen… - … England Journal of …, 2012 - Mass Medical Soc",2012
Identification of copy number variations using high density whole-genome SNP markers in Chinese Dongxiang spotted pigs.,"… Whole-genome sequence data of two DNA pools of Dongxiang spotted pigs were explored 
to detect CNVRs using CNVcaller [25]. We … on the whole-genome sequence data, of which 
119 perfectly overlapped with the 166 CNVRs inferred from the whole-genome 1.4 M SNP data …",https://europepmc.org/articles/pmc6819687/bin/ajas-18-0696-suppl3.pdf,"C Wang, H Chen, X Wang, Z Wu, W Liu… - … journal of animal …, 2019 - europepmc.org",2019
Natural history and pathophysiology of Q fever,"… In the past decade, the complete genome sequencing of C burnetii, the exploration of bacterial 
interactions with the host, and the … The critical role of host factors in the development of 
chronic Q fever has been shown both in human beings and in experimental animals. Interleukin …",https://www.sciencedirect.com/science/article/pii/S1473309905700529,"D Raoult, TJ Marrie, JL Mege - The Lancet infectious diseases, 2005 - Elsevier",2005
Functional and Evolutionary Insights from the Genomes of Three Parasitoid Nasonia Species,"… Nasonia is the second genus of Hymenoptera to have whole-genome sequencing, after 
Apis mellifera (Fig. ), and Nasonia comprises four closely related … Such lateral gene transfers 
between bacteria and animals could be an important source of evolutionary innovation (37). …",https://www.science.org/doi/abs/10.1126/science.1178028,"…, JK Colbourne, Nasonia Genome Working Group… - Science, 2010 - science.org",2010
Emergence of fatal PRRSV variants: unparalleled outbreaks of atypical PRRS in China and molecular dissection of the unique hallmark,"… A novel potent pathogenicity island (PAI) or virulence-associated factor was identified, and 
animal experiments reproduced the high … subjected to whole genome sequencing using T 
vector-based clones. The acquired sequences were assembled into complete genomes with a …",https://journals.plos.org/plosone/article?id=10.1371/journal.pone.0000526,"K Tian, X Yu, T Zhao, Y Feng, Z Cao, C Wang, Y Hu… - PloS one, 2007 - journals.plos.org",2007
The Complete Mitochondrial Genome of the Onychophoran Epiperipatus biolleyi Reveals a Unique Transfer RNA Set and Provides Further Support for the …,"… lack of mitochondrial genome data from onychophorans. Here, we present the first complete 
mitochondrial genome sequence of an … ) bear 24–25 tRNA species in their mitochondrial 
genomes, almost all other animals have a set of 22 tRNAs (fig. ). Among these 22 tRNAs, …",https://academic.oup.com/mbe/article-abstract/25/1/42/1091235,"L Podsiadlowski, A Braband… - Molecular Biology and …, 2008 - academic.oup.com",2008
A role for Piwi and piRNAs in germ cell maintenance and transposon silencing in Zebrafish,"… We found that animals carrying one missense allele (N686K) and one premature stop allele 
(Q543STOP) have germ cells as adults but … –S5B) that are widely distributed over the genome. 
Within clusters we find stretches of sequence up to several kilobases that are represented …",https://www.sciencedirect.com/science/article/pii/S0092867407003923,"S Houwing, LM Kamminga, E Berezikov… - Cell, 2007 - Elsevier",2007
Commensal host-bacterial relationships in the gut,"… The first draft of our complete DNA sequence represents a historic event in our quest for 
self-knowledge (1, 2). Knowing our genotype … as many as our “own” genome). “Gnotobiotic” 
comes from the Greek “known life” and refers to animals with defined microbiological status [germ …",https://science.sciencemag.org/content/292/5519/1115.abstract,"LV Hooper, JI Gordon - Science, 2001 - science.sciencemag.org",2001
Molecular interactions between bacterial symbionts and their hosts,"… The use of MDA may enable rapid progress in complete genome sequencing, especially with 
new large-scale sequencing technologies … in pathogenicity islands found in the genomes 
of a wide range of bacteria that cause disease in both plants and animals, it is important to …",https://www.sciencedirect.com/science/article/pii/S0092867406009652,"C Dale, NA Moran - Cell, 2006 - Elsevier",2006
"Olfaction: diverse species, conserved principles","… only intermittently exposed to the stimulus as the animal moves through the medium, or the 
medium moves over the animal (Figure 1). The … of gene numbers, as genome assemblies 
are incomplete, and draft assemblies can contain sequencing errors that mean some intact …",https://www.sciencedirect.com/science/article/pii/S0896627305008949,"BW Ache, JM Young - Neuron, 2005 - Elsevier",2005
The mosaic structure of variation in the laboratory mouse genome,"… Here we present an analysis of the fine structure of variation in the mouse genome, using 
single nucleotide polymorphisms (SNPs). When the recently assembled genome sequence 
from the C57BL/6J strain 3 is aligned with sample sequence from other strains, we observe …",https://www.nature.com/articles/nature01252,"CM Wade, EJ Kulbokas, AW Kirby, MC Zody… - Nature, 2002 - nature.com",2002
A germline-specific class of small RNAs binds mammalian Piwi proteins,"… -specific guides to regulate messenger RNA stability, protein synthesis, chromatin organization 
and genome structure 1,2,3 . In animals, … abundance, with low-abundance piRNAs being 
absent from our sequencing and not detected by northern blotting. Considered together, our …",https://www.nature.com/articles/nature04917,"A Girard, R Sachidanandam, GJ Hannon, MA Carmell - Nature, 2006 - nature.com",2006
A genome-wide transgenic RNAi library for conditional gene inactivation in Drosophila,"… to potentially any desired cell type at any stage of the animal's lifespan. If a genome-wide 
library of transgenic RNAi strains were available, … predicted protein-coding gene in Release 
4.3 of the Drosophila genome sequence. Where possible, we targeted a single coding exon …",https://www.nature.com/articles/nature05954,"G Dietzl, D Chen, F Schnorrer, KC Su, Y Barinova… - Nature, 2007 - nature.com",2007
The uncultured microbial majority,"… characterized by phenotype or by genome sequencing. Genome sequence information that 
would allow ribosomal RNA gene trees to be related to broader patterns in microbial genome 
evolution is scant, and therefore microbial diversity remains largely unexplored territory. …",https://www.annualreviews.org/doi/abs/10.1146/annurev.micro.57.030502.090759,"MS Rappé, SJ Giovannoni - Annual Reviews in Microbiology, 2003 - annualreviews.org",2003
miRBase: from microRNA sequences to function,"… small RNA deep sequencing datasets and mapped a total of 5.5 billion reads to microRNA 
sequences. The read mapping patterns provide strong support for the validity of between 20% 
and 65% of microRNA annotations in different well-studied animal genomes, and evidence …",https://academic.oup.com/nar/article-abstract/47/D1/D155/5179337,"A Kozomara, M Birgaoanu… - Nucleic acids …, 2019 - academic.oup.com",2019
Classification of papillomaviruses (PVs) based on 189 PV types and proposal of taxonomic amendments,"… animal PVs, we propose founding a reference center for animal PVs. We discuss that based 
on emerging species concepts derived from genome … PVs have traditionally been referred 
to as “types”, a type being a cloned full-length PV genome, whose L1 nucleotide sequence is …",https://www.sciencedirect.com/science/article/pii/S0042682210001005,"HU Bernard, RD Burk, Z Chen, K Van Doorslaer… - Virology, 2010 - Elsevier",2010
Leptospira: the dawn of the molecular genetics era for an emerging zoonotic pathogen,"… Maintenance of leptospirosis in these populations is due to their continued exposure to 
rodent reservoirs or to transmission within animal … , whole-genome sequencing provides an 
opportunity to determine whether such factors exist by screening isolate genomes for genetic …",https://www.nature.com/articles/nrmicro2208,"AI Ko, C Goarant, M Picardeau - Nature Reviews Microbiology, 2009 - nature.com",2009
Lysozymes in the animal kingdom,"Lysozymes (EC 3.2.1.17) are hydrolytic enzymes, characterized by their ability to cleave the 
β-(1,4)-glycosidic bond between N-acetylmuramic acid and N-acetylglucosamine in 
peptidoglycan, the major bacterial cell wall polymer. In the animal kingdom, three major distinct …",https://link.springer.com/article/10.1007/s12038-010-0015-5,"L Callewaert, CW Michiels - Journal of biosciences, 2010 - Springer",2010
