title,content,url,sub_title,year
Sequencing technologies and genome sequencing,"… (HT-NGS) technologies are currently the hottest topic in the field of human and animals 
genomics researches, which can produce over 100 times more data compared to the most 
sophisticated capillary sequencers based on the Sanger method. With the ongoing developments …",https://link.springer.com/article/10.1007/s13353-011-0057-x,"CS Pareek, R Smoczynski, A Tretyn - Journal of applied genetics, 2011 - Springer",2011
Whole-genome sequencing of 234 bulls facilitates mapping of monogenic and complex traits in cattle,"… the same time considering animal health and welfare by providing the annotated sequence 
variants and genotypes of … genome sequence for each of these genotyped individuals and 
to thus provide a discovery population with millions of animals, each with a genome sequence…",https://www.nature.com/articles/ng.3034,"HD Daetwyler, A Capitan, H Pausch, P Stothard… - Nature …, 2014 - nature.com",2014
Genome sequencing and analysis of the model grass Brachypodium distachyon.,"… Here we describe the genome sequence of the wild grass Brachypodium distachyonbrachypodium 
distachyonSubject Category: … for analysis of the large genomes of economically important 
pooid grasses such as wheat. The high-quality genome sequence, coupled with ease of …",https://www.cabdirect.org/cabdirect/abstract/20103050459,"International Brachypodium Initiative - Nature (London), 2010 - cabdirect.org",2010
Genome sequencing reveals insights into physiology and longevity of the naked mole rat,"… Here we report the sequencing and analysis of the naked mole rat genome, which reveals 
unique genome features and molecular … To summarize, sequencing and analysis of the 
NMR genome revealed numerous insights into the biology of this remarkable animal. In …",https://www.nature.com/articles/nature10533,"EB Kim, X Fang, AA Fushan, Z Huang, AV Lobanov… - Nature, 2011 - nature.com",2011
The Amphimedon queenslandica genome and the evolution of animal complexity,"… group of animals that diverged from other metazoans over 600 million years ago. Here we 
present the draft genome sequence of Amphimedon queenslandica, a demosponge from the 
Great Barrier Reef, and show that it is remarkably similar to other animal genomes in content, …",https://www.nature.com/articles/nature09201,"M Srivastava, O Simakov, J Chapman, B Fahey… - Nature, 2010 - nature.com",2010
The genome sequence of taurine cattle: a window to ruminant biology and evolution,"… animals as easy meat. Soon other possibilities became apparent, and as revealed in a series 
of papers in this issue, early pastoralists became selective about breeding for wool, leather, 
milk, and muscle power. In two papers, Gibbs et al. report on the bovine genome sequence (…",https://www.science.org/doi/abs/10.1126/science.1169588,"Bovine Genome Sequencing and Analysis Consortium… - Science, 2009 - science.org",2009
Genome sequencing and population genomics in non-model organisms,"… current status of genome sequencing in non-model organisms of animals, plants, and other 
eukaryotes, and what the sequences can inform about evolution. I then discuss the state of 
the art in the field of population genomics in which whole-genome sequencing of population …",https://www.sciencedirect.com/science/article/pii/S0169534713002310,"H Ellegren - Trends in ecology & evolution, 2014 - Elsevier",2014
Sequence and comparative analysis of the chicken genome provide unique perspectives on vertebrate evolution.,"… In all vertebrate and most other animal genomes studied thus far, at least one recently or 
currently active SINE family has been found, mostly derived from a transfer RNA and often 
constituting the most numerous interspersed repeat. It is therefore remarkable that the abundant …",https://escholarship.org/uc/item/44v0c3r5,"International Chicken Genome Sequencing … - Nature, 2004 - escholarship.org",2004
The dynamic genome of Hydra,"… We also report the sequence of the genome of a novel bacterium stably associated with H. 
magnipapillata. Comparisons of the Hydra … of the Hydra genome sequence and methods to 
manipulate it 30 provide an opportunity to understand how this remarkable animal evolved. …",https://www.nature.com/articles/nature08830,"JA Chapman, EF Kirkness, O Simakov, SE Hampson… - Nature, 2010 - nature.com",2010
Animal models of human placentation–a review,"… The rabbit is well established as a laboratory animal and has been used for studies of placental 
circulation and placental transfer [31], [32]. … for housing of this rather large animal. However, 
the rabbit is among species selected for genome sequencing and is no more distant from …",https://www.sciencedirect.com/science/article/pii/S0143400406002724,"AM Carter - Placenta, 2007 - Elsevier",2007
De novo assembly of human genomes with massively parallel short read sequencing,"… It is, however, expensive, and this prevents many genome sequencing projects from 
being put into practice. Over the past 10 yr, only a limited number of plant and animal 
genomes have been completely sequenced, (http://www.ncbi.nlm.nih.gov/genomes/static/gpstat.html), …",https://genome.cshlp.org/content/20/2/265.short,"R Li, H Zhu, J Ruan, W Qian, X Fang, Z Shi… - Genome …, 2010 - genome.cshlp.org",2010
Systematic functional analysis of the Caenorhabditis elegans genome using RNAi,"… genes with animal-specific domains are, in general, more likely to have an ‘animal-specific’ … 
in yeast, Arabidopsis, Drosophila and humans; ‘animal’, in which at least one domain is found 
in … When an assembled genome sequence is available for the nematode Caenorhabditis …",https://www.nature.com/articles/nature01278,"RS Kamath, AG Fraser, Y Dong, G Poulin, R Durbin… - Nature, 2003 - nature.com",2003
Advances in swine biomedical model genomics,"… an asset that the pig genome has high sequence and chromosome structure homology with 
humans. With the swine genome sequence now well … Generally speaking, studying animal 
models of human disease helps scientists understand the mechanisms involved in the disease …",https://www.ncbi.nlm.nih.gov/pmc/articles/pmc1802015/,"JK Lunney - International journal of biological sciences, 2007 - ncbi.nlm.nih.gov",2007
Initial impact of the sequencing of the human genome,"… genome sequence de novo from such short reads, most applications have focused on placing 
reads onto the scaffold of an existing genome sequence to count their density or to look for 
differences from a reference sequence… to sequence the whole genome of a selected animal …",https://www.nature.com/articles/nature09792,"ES Lander - Nature, 2011 - nature.com",2011
The genome of the choanoflagellate Monosiga brevicollis and the origin of metazoans,"Choanoflagellates are the closest known relatives of metazoans. To discover potential molecular mechanisms underlying the evolution of metazoan multicellularity, we sequenced and analysed the genome of the unicellular choanoflagellate Monosiga brevicollis. The …",https://www.nature.com/articles/nature06617,"…, S Nichols, DJ Richter, A Salamov, JGI Sequencing… - Nature, 2008 - nature.com",2008
The genome of the social amoeba Dictyostelium discoideum,"… A proteome-based phylogeny shows that the amoebozoa diverged from the animal–fungal 
lineage after the plant–animal split, but Dictyostelium seems to have retained more of the diversity 
of the ancestral genome than have plants, animals … Genome sequencing and assembly …",https://www.nature.com/articles/nature03481,"L Eichinger, JA Pachebat, G Glöckner, MA Rajandream… - Nature, 2005 - nature.com",2005
"The B73 maize genome: complexity, diversity, and dynamics","… We report an improved draft nucleotide sequence of the 2.3-gigabase genome of maize, 
an important crop plant and model for biological research. Over 32,000 genes were 
predicted, of which 99.8% were placed on reference chromosomes. Nearly 85% of the …",https://science.sciencemag.org/content/326/5956/1112.abstract,"PS Schnable, D Ware, RS Fulton, JC Stein, F Wei… - …, 2009 - science.sciencemag.org",2009
MAKER: an easy-to-use annotation pipeline designed for emerging model organism genomes,"… a genome sequence into a community-accessible genome database. MAKER should prove 
especially useful for emerging model organism genome … mediterranea annotations to other 
annotated animal genomes. These data are shown in Supplemental Table 2 and demonstrate …",https://genome.cshlp.org/content/18/1/188.short,"BL Cantarel, I Korf, SMC Robb, G Parra… - Genome …, 2008 - genome.cshlp.org",2008
The new frontier of genome engineering with CRISPR-Cas9,"… The field of biology is now experiencing a transformative phase with the advent of facile 
genome engineering in animals and plants using RNA-… The advent of genomic sequencing 
technologies and the rapid generation of whole-genome sequencing data for large numbers and …",https://science.sciencemag.org/content/346/6213/1258096.abstract,"JA Doudna, E Charpentier - Science, 2014 - science.sciencemag.org",2014
Complete genome sequence of the shrimp white spot bacilliform virus,"… In summary, we have obtained the complete genome sequence of WSBV. This is the first 
complete genome sequence from a marine invertebrate virus. It is also the largest animal virus 
genome sequenced (8, 52). As the genomic data demonstrated, more than 80% of WSBV …",https://journals.asm.org/doi/abs/10.1128/JVI.75.23.11811-11820.2001,"F Yang, J He, X Lin, Q Li, D Pan, X Zhang… - Journal of virology, 2001 - Am Soc Microbiol",2001
Micro RNAs in animal development,"… This hypothesis can be tested by genome sequence comparisons as well as by other 
experiments. Perhaps differences in the development of … The continued scrutiny of miRNAs 
and their target mRNAs in animal cells certainly will provide fresh insights into the importance of …",https://www.sciencedirect.com/science/article/pii/S0092867406002479,"RHA Plasterk - Cell, 2006 - Elsevier",2006
Metagenomic pyrosequencing and microbial identification,"… sequencing and the whole-genome sequencing approach may be useful for human 
metagenomics, and numerous bioinformatics tools are being deployed to tackle such vast amounts 
of microbiological sequence … to individual microbial or animal genomes, is ultracomplex and …",https://academic.oup.com/clinchem/article-abstract/55/5/856/5629254,"JF Petrosino, S Highlander, RA Luna… - Clinical …, 2009 - academic.oup.com",2009
Meticillin-resistant Staphylococcus aureus with a novel mecA homologue in human and bovine populations in the UK and Denmark: a descriptive study,"… We used whole-genome sequencing to establish the genetic basis for the observed … 66)—a 
lineage that is thought to be unique to animals 32 —or other strain types detected in cattle … 
multilocus sequence type lineages, and the fact that it is bounded by integration site sequence …",https://www.sciencedirect.com/science/article/pii/S1473309911701268,"L García-Álvarez, MTG Holden, H Lindsay… - The Lancet infectious …, 2011 - Elsevier",2011
Evolution of microRNA diversity and regulation in animals,"… Here, I summarize our current knowledge about evolution of miRNA systems in animals. 
First, an overview of the phylogenetic … sequencing, as well as northern blot and in situ 
hybridization approaches, a number of studies on the distribution of miRNAs across the animal …",https://www.nature.com/articles/nrg3079,"E Berezikov - Nature Reviews Genetics, 2011 - nature.com",2011
Staphylococcus aureus CC398: host adaptation and emergence of methicillin resistance in livestock,"… IMPORTANCE Modern food animal production is characterized by densely concentrated 
animals and routine … genome sequencing has been used to study the hospital transmission 
and spatiotemporal spread of ST239 (15). In this study, we applied whole-genome sequence …",https://journals.asm.org/doi/abs/10.1128/mbio.00305-11,"LB Price, M Stegger, H Hasman, M Aziz, J Larsen… - MBio, 2012 - Am Soc Microbiol",2012
… Transcriptome Sequencing Project (MMETSP): illuminating the functional diversity of eukaryotic life in the oceans through transcriptome sequencing,"… Note that multicellular organisms are included (unlike in A or C); animals, land plants, and 
multicellular rhodophytes are included in the … In the past, we have described a protistan lineage 
for which there is a single genome sequence as being “well studied.” Thus, even for those …",https://journals.plos.org/plosbiology/article?id=10.1371/journal.pbio.1001889,"PJ Keeling, F Burki, HM Wilcox, B Allam, EE Allen… - PLoS …, 2014 - journals.plos.org",2014
Lateral transfer of genes from fungi underlies carotenoid production in aphids,"… However, genome sequencing has revealed that neither the primary symbiont Buchnera 
aphidicola (15) nor two … sequence homology to carotenoid biosynthetic genes of several fungi, 
but no detectable homology to enzymes encoded by any other available animal genome. In …",https://science.sciencemag.org/content/328/5978/624.abstract,"NA Moran, T Jarvik - science, 2010 - science.sciencemag.org",2010
microRNA target predictions in animals,"… Our understanding of miRNA function is still extremely limited, but it may be that by 
integrating mRNA and miRNA sequence and expression data with other comparative genomic 
data, we will be able to gain global and yet specific insights into the function and evolution of a …",https://www.nature.com/articles/ng1798,"N Rajewsky - Nature genetics, 2006 - nature.com",2006
Tracing the animal sources of surface water contamination with Campylobacter jejuni and Campylobacter coli,"… coli isolate was selected at random for whole-genome sequencing (WGS). … However, here 
we were interested in knowing the most likely animal origin of an isolate as a whole based 
on its genome and our goal was not to make evolutionary inference about the life history of …",https://www.sciencedirect.com/science/article/pii/S0043135420309568,"AC Mulder, E Franz, S de Rijk, MAJ Versluis, C Coipan… - Water Research, 2020 - Elsevier",2020
Off-target effects in CRISPR/Cas9-mediated genome engineering,"… , 2 It now also holds great promise in diverse fields such as animal disease modeling, material 
science, genetically modified plant … lines with dysregulated DSBs repair pathways, while 
whole-genome sequencing of healthy human pluripotent stem cell clones with relatively intact …",https://www.sciencedirect.com/science/article/pii/S216225311630049X,"XH Zhang, LY Tee, XG Wang, QS Huang… - … Therapy-Nucleic Acids, 2015 - Elsevier",2015
Using the Acropora digitifera genome to understand coral responses to environmental change,"… Genome sequencing and assembly The sperm was obtained from the single colony and 
sperm DNA was used for genome sequencing and BAC library construction. Genome sequence 
data were obtained using single read, paired-end and mate-pair protocols on the Roche …",https://www.nature.com/articles/nature10249,"C Shinzato, E Shoguchi, T Kawashima, M Hamada… - Nature, 2011 - nature.com",2011
A genetic variation map for chicken with 2.8 million single nucleotide polymorphisms,"… each and compared the resultant sequence to the 6.6x draft genome of Red Jungle Fowl (… 
Comparing the sequence reads for broiler, layer, and Silkie to the genome of RJF, we … This 
analysis has provided the first global assessment of nucleotide diversity for a domestic animal in …",https://www.ncbi.nlm.nih.gov/pmc/articles/PMC2263125/,"International Chicken Polymorphism Map Consortium - Nature, 2004 - ncbi.nlm.nih.gov",2004
The genome sequence of the SARS-associated coronavirus,"… The genome sequence reveals that this coronavirus is only moderately related to other 
known coronaviruses, including two human … The genome sequence will aid in the diagnosis 
of SARS virus infection in humans and potential animal hosts (using polymerase chain reaction …",https://science.sciencemag.org/content/300/5624/1399.abstract,"MA Marra, SJM Jones, CR Astell, RA Holt… - …, 2003 - science.sciencemag.org",2003
Reconstructing mitochondrial genomes directly from genomic next-generation sequencing reads—a baiting and iterative mapping approach,"… to most animal mitochondrial genomes except for rare cases of mitochondrial genomes 
containing repeats. For such cases, the mitochondrial genome of a distantly related species 
will be the more promising reference sequence for completing a novel mitochondrial genome. …",https://academic.oup.com/nar/article-abstract/41/13/e129/1129833,"C Hahn, L Bachmann, B Chevreux - Nucleic acids research, 2013 - academic.oup.com",2013
The origin and early evolution of mitochondria,"… In both cases, certain clades (such as animals plus fungi or red … sequence with the 
mitochondrial genome sequence of Reclinomonas americana (the 'most bacterial' of sequenced 
mtDNAs) solidifies the conclusion drawn from other kinds of data that the mitochondrial genome …",https://link.springer.com/article/10.1186/gb-2001-2-6-reviews1018,"MW Gray, G Burger, BF Lang - Genome biology, 2001 - Springer",2001
"Natural product discovery: past, present, and future","… as commercial products for human medicine, animal health, and plant crop protection. In the 
… , it was discovered from genome sequencing that microbes with large genomes have the … 
for genome sequencing, it is now feasible to sequence thousands of actinomycete genomes …",https://academic.oup.com/jimb/article-abstract/43/2-3/155/5995722,"L Katz, RH Baltz - Journal of Industrial Microbiology and …, 2016 - academic.oup.com",2016
Characterization of polyploid wheat genomic diversity using a high‐density 90 000 single nucleotide polymorphism array,"… Due to low coding sequence divergence between homoeologous gene copies on 
different wheat genomes (2%–4%), and often between paralogous gene copies on the same 
genome, oligonucleotide probes can hybridize not only to the targeted locus, but also to its …",https://onlinelibrary.wiley.com/doi/abs/10.1111/pbi.12183,"…, International Wheat Genome Sequencing … - Plant biotechnology …, 2014 - Wiley Online Library",2014
"Genome sequence, comparative analysis, and population genetics of the domestic horse","… We report a high-quality draft sequence of the genome of the horse (Equus caballus). The 
genome is relatively repetitive but has little segmental … Belonging to the order perissodactyla 
(ie, odd-toed animals with hooves), the genus Equus radiated into 8 or 9 species around three …",https://science.sciencemag.org/content/326/5954/865.abstract,"CM Wade, E Giulotto, S Sigurdsson, M Zoli… - …, 2009 - science.sciencemag.org",2009
Prospective Genomic Characterization of the German Enterohemorrhagic Escherichia coli O104:H4 Outbreak by Rapid Next Generation Sequencing …,"… animals, has rarely been associated with HUS in the past. To prospectively elucidate the 
unique characteristics of this strain in the early stages of this outbreak, we applied whole genome 
sequencing … :H4 strains and the previously published sequence of the EAEC strain 55989 …",https://journals.plos.org/plosone/article?id=10.1371/journal.pone.0022751,"A Mellmann, D Harmsen, CA Cummings, EB Zentz… - PloS one, 2011 - journals.plos.org",2011
Genome sequence of the Brown Norway rat yields insights into mammalian evolution,"… animal … genome sequence, both by itself and in context with the mouse and human genome 
sequences. Although the rat is not a member of the Security Council of Model Genetic Organisms 
(Fink ref), this publication of the draft sequence and the compendium papers (Genome …",https://authors.library.caltech.edu/74926/,"RA Gibbs, L Pachter - Nature, 2004 - authors.library.caltech.edu",2004
Tunicates and not cephalochordates are the closest living relatives of vertebrates,"… Taking advantage of the genome sequencing of the appendicularian Oikopleura dioica, we 
… and genomic studies in which tunicates and cephalochordates are used as model animals. 
… of 146 nuclear genes previously assembled to study animal phylogeny 7 . This data set was …",https://www.nature.com/articles/nature04336,"F Delsuc, H Brinkmann, D Chourrout, H Philippe - Nature, 2006 - nature.com",2006
Suppression of long-branch attraction artefacts in the animal phylogeny using a site-heterogeneous model,"… Thanks to the large amount of signal contained in genome-wide sequence alignments, … In 
an otherwise consistent probabilistic framework, systematic errors in genome-wide analyses 
… test, allowing one to measure how well a model acknowledges sequence saturation. …",https://bmcecolevol.biomedcentral.com/articles/10.1186/1471-2148-7-S1-S4,"N Lartillot, H Brinkmann… - BMC …, 2007 - bmcecolevol.biomedcentral.com",2007
Lessons from the Genome Sequence of Neurospora crassa: Tracing the Path from Genomic Blueprint to Multicellular Organism,"We present an analysis of over 1,100 of the ∼10,000 predicted proteins encoded by the genome 
sequence of the filamentous fungus Neurospora crassa. Seven major areas of Neurospora 
genomics and biology are covered. First, the basic features of the genome, including the …",https://journals.asm.org/doi/abs/10.1128/mmbr.68.1.1-108.2004,"KA Borkovich, LA Alex, O Yarden… - Microbiology and …, 2004 - Am Soc Microbiol",2004
Hybridization as an invasion of the genome,"… Today, DNA sequence data and other molecular methods are beginning to show that limited 
invasions of the genome are widespread, with … Much of the best literature on natural 
hybridization is about plants, but I concentrate particularly on animal data because zoologists have …",https://www.sciencedirect.com/science/article/pii/S016953470500039X,"J Mallet - Trends in ecology & evolution, 2005 - Elsevier",2005
"Emerging coronaviruses: genome structure, replication, and pathogenesis","… The genome sequence alignment of CoVs shows 58% identity on the nsp-coding region … 
among different CoVs, with 54% at the whole genome level (Figure 1B, upper panel), suggesting 
… from animal to human, CoVs in livestock and other animals including bats and wild animals …",https://onlinelibrary.wiley.com/doi/abs/10.1002/jmv.25681,"Y Chen, Q Liu, D Guo - Journal of medical virology, 2020 - Wiley Online Library",2020
Development and characterization of a high density SNP genotyping assay for cattle,"… We thank Lee Alexander for providing the parental DNAs from the Genome Sequencing 
animal. We thank the Bovine HapMap consortium for providing the DNAs and the Baylor 
college of medicine for the sequencing and assembly of the cattle genome. …",https://journals.plos.org/plosone/article?id=10.1371/journal.pone.0005350,"LK Matukumalli, CT Lawley, RD Schnabel, JF Taylor… - PloS one, 2009 - journals.plos.org",2009
Genomics of microRNA,"… Our focus is on animal miRNAs. … genome [35]. ProMiR successfully detects miRNA genes 
with no clear sequence similarity to known miRNA genes. Nine out of 23 representative 
candidate genes (39%) were validated by a RT-PCR-based method for expression in HeLa cells. …",https://www.sciencedirect.com/science/article/pii/S0168952506000217,"VN Kim, JW Nam - TRENDS in Genetics, 2006 - Elsevier",2006
The genome of the blood fluke Schistosoma mansoni,"… The nuclear genome sequence of S. mansoni was determined by whole-genome shotgun 
sequencing and assembled into 5,745 scaffolds greater than 2 kilobases (… Historically, 
anti-schistosomiasis agents were identified by in vivo screening in animal models. The S. mansoni …",https://www.nature.com/articles/nature08160,"M Berriman, BJ Haas, PT LoVerde, RA Wilson… - Nature, 2009 - nature.com",2009
Symbiotic diversity in marine animals: the art of harnessing chemosynthesis,"… vent animals, scientists also searched the literature for descriptions of free-living animals that 
… Animals from at least seven different phyla are currently known to harbour chemosynthetic 
… Our 16S rRNA sequence analyses and fluorescence in situ hybridization (FISH) confirm that …",https://www.nature.com/articles/nrmicro1992,"N Dubilier, C Bergin, C Lott - Nature Reviews Microbiology, 2008 - nature.com",2008
Evolution of the novel coronavirus from the ongoing Wuhan outbreak and modeling of its spike protein for risk of human transmission,"… Both happened in winter with initial cases linked to exposure to live animals sold at animal 
markets, and both were caused by previously … the data and genome sequencing sharing. In 
addition, we acknowledge GISAID (https://www.gisaid.org/) for facilitating open data sharing. …",https://link.springer.com/article/10.1007/s11427-020-1637-5,"X Xu, P Chen, J Wang, J Feng, H Zhou, X Li… - Science China Life …, 2020 - Springer",2020
Transcriptional enhancers: from properties to genome-wide predictions,"… be detected by DNase I hypersensitive site sequencing (DNase-seq), micrococcal nuclease 
sequencing (MNase-seq), formaldehyde-… in animal genomes. In this Review, we discuss how 
properties of enhancer sequences and chromatin are used to predict enhancers in genome-…",https://www.nature.com/articles/nrg3682,"D Shlyueva, G Stampfel, A Stark - Nature Reviews Genetics, 2014 - nature.com",2014
