title,content,url,sub_title,year
Plant genome annotation methods,"… sources of genomic sequence along with methods and resources of use to general plant 
biologists in … ) genomic sequence that can be found on the finished bacterial artificial chromosome 
(BAC) clone OSJNBa0094F01. The sequence of this BAC can be obtained from the Plant …",https://link.springer.com/protocol/10.1007/978-1-59745-427-8_14,"S Ouyang, F Thibaud-Nissen, KL Childs, W Zhu… - Plant Genomics, 2009 - Springer",2009
Genome sequence of the palaeopolyploid soybean,"… The soybean genome is the largest whole-genome shotgun-sequenced plant genome so 
far and compares favourably to all other high-quality draft whole-genome shotgun-sequenced 
plant genomes (Supplementary Table 4). A total of 8 of the 20 chromosomes have telomeric …",https://www.nature.com/articles/nature08670,"J Schmutz, SB Cannon, J Schlueter, J Ma, T Mitros… - nature, 2010 - nature.com",2010
Long-read human genome sequencing and its applications,"… Long-read genome sequencing has substantially enhanced our understanding of the full 
spectrum of human genetic variation 32,33,64 . A comparison of the same individuals sequenced 
with the Illumina short-read and PacBio long-read platforms, for example, showed that 47…",https://www.nature.com/articles/s41576-020-0236-x,"GA Logsdon, MR Vollger, EE Eichler - Nature Reviews Genetics, 2020 - nature.com",2020
Toward Sequencing Cotton (Gossypium) Genomes,"Despite rapidly decreasing costs and innovative technologies, sequencing of angiosperm genomes is not yet undertaken lightly. Generating larger amounts of sequence data more quickly does not address the difficulties of sequencing and assembling complex genomes  …",https://academic.oup.com/plphys/article-abstract/145/4/1303/6107067,"ZJ Chen, BE Scheffler, E Dennis, BA Triplett… - Plant …, 2007 - academic.oup.com",2007
"Low‐coverage, whole‐genome sequencing of Artocarpus camansi (Moraceae) for phylogenetic marker development and gene discovery","Premise of the study: We used moderately low‐coverage (17×) whole‐genome sequencing of Artocarpus camansi (Moraceae) to develop genomic resources for Artocarpus and Moraceae. Methods and Results: A de novo assembly of Illumina short reads (251,378,536 …",https://bsapubs.onlinelibrary.wiley.com/doi/abs/10.3732/apps.1600017,"EM Gardner, MG Johnson, D Ragone… - Applications in plant …, 2016 - Wiley Online Library",2016
LTR retrotransposons and flowering plant genome size: emergence of the increase/decrease model,"… More recently, the availability of large insert libraries, along with the development of genome 
sequencing projects, has yielded numerous large plant genomic sequences and therefore 
facilitated the discovery of new LTR retrotransposons. This has been particularly the case for …",https://www.karger.com/Article/Abstract/84941,"C Vitte, O Panaud - Cytogenetic and genome research, 2005 - karger.com",2005
Genome Sequencing Application on Molecular Characterization Assessment of Transgenic Plant,"Molecular characterization is an important basis for selecting and identifying transgenic event, and also the main content which must be provided for safety assessment of transgenic plant. The development of DNA sequencing technology provides a new strategy …",https://www.nkdb.net/EN/abstract/abstract11542.shtml,"MA Shuo, J Yue, W Xujing, Z Yong… - Journal of Agricultural …, 2020 - nkdb.net",2020
Applications of next‐generation sequencing in plant biology,"… on the shotgun sequencing of microbial genomes (eg, 27; 51), but this system has clearly made 
its way into programs pursuing plant‐based objectives, … It has a huge and complex 
allohexaploid genome making complete genome sequencing a major challenge. The bread wheat …",https://bsapubs.onlinelibrary.wiley.com/doi/abs/10.3732/ajb.1200020,"AN Egan, J Schlueter… - American journal of …, 2012 - Wiley Online Library",2012
"LeafGo: Leaf to Genome, a quick workflow to produce high-quality de novo plant genomes using long-read sequencing technology","Currently, different sequencing platforms are used to generate plant genomes and no workflow has been properly developed to optimize time, cost, and assembly quality. We present LeafGo, a complete de novo plant genome workflow, that starts from tissue and …",https://genomebiology.biomedcentral.com/articles/10.1186/s13059-021-02475-z,"P Driguez, S Bougouffa, K Carty… - Genome …, 2021 - genomebiology.biomedcentral.com",2021
A GeneTrek analysis of the maize genome,"… Whole-genome sequence analysis has revolutionized the field of plant genetics. A sequenced 
… Here we describe a procedure for accurately predicting plant genome structure and 
composition with a relatively small data input and use this approach in comprehensive sequence …",https://www.pnas.org/content/104/28/11844.short,"R Liu, C Vitte, J Ma, AA Mahama… - Proceedings of the …, 2007 - National Acad Sciences",2007
The physical and genetic framework of the maize B73 genome,"… Post-genome sequencing, we constructed a golden path (AGP) of sequence-based 
pseudomolecules representing the ten chromosomes … , the generation of a whole genome 
sequence of maize offers the greatest technical challenge to date for any complex plant genome. …",https://journals.plos.org/plosgenetics/article?id=10.1371/journal.pgen.1000715,"F Wei, J Zhang, S Zhou, R He, M Schaeffer… - PLoS …, 2009 - journals.plos.org",2009
Microbial genome sequencing,"… Microbes were the first organisms on Earth and preceded animals and plants by more than 
3 … of microbial species is far greater than that found in plants and animals. But the diversity of 
the … Perhaps no other area of research has been so energized by the application of genomic …",https://www.nature.com/articles/35021244,"CM Fraser, JA Eisen, SL Salzberg - Nature, 2000 - nature.com",2000
"Draft genome sequencing of Stenotrophomonas indicatrix BOVIS40 and Stenotrophomonas maltophilia JVB5, two strains with identifiable genes involved in plant …","Here, plant growth-promoting Stenotrophomonas strains isolated from the sunflower root endosphere were studied. Bacterial DNA was sequenced on Illumina's NextSeq platform. The gene prediction reveals diverse functional genes involved in plant growth promotion …",https://journals.asm.org/doi/abs/10.1128/MRA.00482-21,"OO Babalola, BS Adeleke… - Microbiology Resource …, 2021 - Am Soc Microbiol",2021
Genome-wide analyses of alternative splicing in plants: opportunities and challenges,"… However, recently available plant genome and transcript sequence data sets are enabling 
a global analysis of AS in many … The increasing availability of plant genome sequence data 
will enable larger comparative analyses that will identify functionally important plant AS events …",https://genome.cshlp.org/content/18/9/1381.short,"WB Barbazuk, Y Fu, KM McGinnis - Genome research, 2008 - genome.cshlp.org",2008
An integrated physical and genetic map of the rice genome,"… Rice was chosen as a model organism for genome sequencing because of its economic 
importance, small genome size, and syntenic … –based physical map of the rice genome to 
facilitate the whole-genome sequencing of rice. Most of the rice genome (∼90.6%) was anchored …",https://academic.oup.com/plcell/article-abstract/14/3/537/6009665,"M Chen, G Presting, WB Barbazuk… - The Plant …, 2002 - academic.oup.com",2002
Application of high‐throughput genome sequencing to intrapathovar variation in Pseudomonas syringae,"One reason for the success of Pseudomonas syringae as a model pathogen has been the availability of three complete genome sequences since 2005. Now, at the beginning of 2011, more than 25 strains of P. syringae have been sequenced and many more will soon …",https://bsppjournals.onlinelibrary.wiley.com/doi/abs/10.1111/j.1364-3703.2011.00713.x,"DJ Studholme - Molecular plant pathology, 2011 - Wiley Online Library",2011
Large-scale genome sequencing of mycorrhizal fungi provides insights into the early evolution of symbiotic traits,"… plants 3,25 . Here, we present a combined analysis of 135 fungal genomes from 73 
saprotrophic, endophytic and pathogenic fungal species, and 62 mycorrhizal fungal species, 
including 29 new mycorrhizal genomes. This study approximately doubles the number of published …",https://www.nature.com/articles/s41467-020-18795-w,"S Miyauchi, E Kiss, A Kuo, E Drula, A Kohler… - Nature …, 2020 - nature.com",2020
"Whole genome sequencing and analysis of Swarna, a widely cultivated indica rice variety with low glycemic index","… genome-based polymorphism study on rice varieties with low GI. Therefore, we have sequenced 
the whole genome of Swarna rice variety by Illumina’s paired-end sequencing … (InDels) by 
aligning it with the Nipponbare genome sequence as reference. In addition to the detailed …",https://www.nature.com/articles/srep11303,"P Rathinasabapathi, N Purushothaman… - Scientific reports, 2015 - nature.com",2015
The sugarcane genome challenge: strategies for sequencing a highly complex genome,Sugarcane cultivars derive from interspecific hybrids obtained by crossing Saccharum officinarum and Saccharum spontaneum and provide feedstock used worldwide for sugar and biofuel production. The importance of sugarcane as a bioenergy feedstock has …,https://link.springer.com/article/10.1007/s12042-011-9079-0,"GM Souza, H Berges, S Bocs, R Casu, A D'Hont… - Tropical plant …, 2011 - Springer",2011
Transpositional landscape of the rice genome revealed by paired‐end mapping of high‐throughput re‐sequencing data,"Transposable elements (TEs) are mobile entities that densely populate most eukaryotic genomes and contribute to both their structural and functional dynamics. However, most TE‐related sequences in both plant and animal genomes correspond to inactive, degenerated …",https://onlinelibrary.wiley.com/doi/abs/10.1111/j.1365-313X.2011.04492.x,"F Sabot, N Picault, M El‐Baidouri, C Llauro… - The Plant …, 2011 - Wiley Online Library",2011
Earth BioGenome Project: Sequencing life for the future of life,"… We anticipate that new methods for whole-genome sequencing of unicellular organisms (18) 
will contribute to the discovery of new eukaryotic … on a strategy and justification to sequence 
and annotate all eukaryotic genomes, including vertebrates, invertebrates, plants, fungi, and …",https://www.pnas.org/content/115/17/4325.short,"HA Lewin, GE Robinson, WJ Kress… - Proceedings of the …, 2018 - National Acad Sciences",2018
Challenges to genome sequence dissection in sweetpotato,"… of next generation sequencing (NGS) technologies has drastically changed plant genomic 
and ge… sequencing the sweetpotato genome. In this manuscript, we review the recent results 
and activities of large-scale genome and transcriptome analysis related to genome sequence …",https://www.jstage.jst.go.jp/article/jsbbs/advpub/0/advpub_16186/_article/-char/ja/,"S Isobe, K Shirasawa, H Hirakawa - Breeding Science, 2017 - jstage.jst.go.jp",2017
Dynamics and adaptive benefits of protein domain emergence and arrangements during plant genome evolution,"… domains and complex arrangements in plant genomes demonstrate the importance of 
modularity for environmental adaptability of plants. … Duplications have been more frequently 
described for plants than elsewhere and plant genome evolution is special in several aspects. …",https://academic.oup.com/gbe/article-abstract/4/3/316/562278,"AR Kersting, E Bornberg-Bauer… - Genome biology and …, 2012 - academic.oup.com",2012
Complete Plastid Genome Sequencing of Four Tilia Species (Malvaceae): A Comparative Analysis and Phylogenetic Implications,"… The number of sequenced plant plastid genomes increased rapidly during last decade due 
to the establishment of the next-generation … we applied Tajima relative rate test [38] on the 
plastid genome sequence alignment. The relative rates of evolution between each of the four …",https://journals.plos.org/plosone/article?id=10.1371/journal.pone.0142705,"J Cai, PF Ma, HT Li, DZ Li - PLoS One, 2015 - journals.plos.org",2015
Whole genome sequencing-based association study to unravel genetic architecture of cooked grain width and length traits in rice,"In this study, we used 2.9 million single nucleotide polymorphisms (SNP) and 393,429 indels 
derived from whole genome sequences of 591 rice landraces to determine the genetic basis 
of cooked and raw grain length, width and shape using genome-wide association study (…",https://www.nature.com/articles/s41598-017-12778-6,"G Misra, S Badoni, R Anacleto, A Graner… - Scientific reports, 2017 - nature.com",2017
Targeted plant genome editing via the CRISPR/Cas9 technology,"… Plant genome sequences are accumulating at a staggering rate due to the advent and 
rapid advance of whole-genome sequencing technologies, which in turn call for revolution of 
targeted genome editing tools. Using various designer endonucleases as “genomic scissors,” …",https://link.springer.com/protocol/10.1007/978-1-4939-2444-8_12,"JF Li, D Zhang, J Sheen - Plant functional genomics, 2015 - Springer",2015
In Silico Whole Genome Sequencer and Analyzer (iWGS): a Computational Pipeline to Guide the Design and Analysis of de novo Genome Sequencing Studies,"… focused on specific challenges frequently encountered in de novo genome sequencing 
studies (eg, high repeat content and biased nucleotide composition, etc.), we illustrate how iWGS 
can be applied to guiding the design and analysis of de novo genome sequencing studies. …",https://academic.oup.com/g3journal/article-abstract/6/11/3655/6031108,"X Zhou, D Peris, J Kominek… - … : Genes, Genomes …, 2016 - academic.oup.com",2016
"Next is now: new technologies for sequencing of genomes, transcriptomes, and beyond","The sudden availability of DNA sequencing technologies that rapidly produce vast amounts of sequence information has triggered a paradigm shift in genomics, enabling massively parallel surveying of complex nucleic acid populations. The diversity of applications to which …",https://www.sciencedirect.com/science/article/pii/S1369526608002008,"R Lister, BD Gregory, JR Ecker - Current opinion in plant biology, 2009 - Elsevier",2009
Possibility of Uncoding Structural Organization of Genome in Rice Research: Prospects and Approaches by 3D Genome Sequencing,"… like, eg, rice, sorghum, tomato, cotton, maize, jatropha except for Arabidopsis because of 
the absence of insulator sequence, which is typical … Plant genomes have been found to vary 
in relation to the orientation of the chromosomes and the territories. A plant genome may be in “…",https://link.springer.com/chapter/10.1007/978-981-16-3997-5_1,"BK Bhowmick - Applications of Bioinformatics in Rice Research, 2021 - Springer",2021
Accelerating public sector rice breeding with high-density KASP markers derived from whole genome sequencing of indica rice,"… despite rapidly expanding repositories of rice genome sequence data. They rely on > 18,000 
… , cheaper than SSRs and more flexible than genotyping by sequencing (GBS) or array-based 
… Furthermore, we provide the software for plant breeders to generate KASP designs from …",https://link.springer.com/article/10.1007/s11032-018-0777-2,"KA Steele, MJ Quinton-Tulloch, RB Amgai, R Dhakal… - Molecular …, 2018 - Springer",2018
Analysis of the genome sequence of the medicinal plant Salvia miltiorrhiza,"Raw Illumina Hiseq 2000, the Roche/454 and PacBio sequencing reads of S. miltiorrhiza line 99-3 and Raw Illumina Hiseq 2000 sequencing reads of The white-flowered landrace S. miltiorrhiza have been submitted to the NCBI Sequence Read Archive database …",https://www.ncbi.nlm.nih.gov/pmc/articles/pmc5517341/,"H Xu, J Song, H Luo, Y Zhang, Q Li, Y Zhu, J Xu… - … plant, 2016 - ncbi.nlm.nih.gov",2016
Design of guide RNA for CRISPR/Cas plant genome editing,"… For example, full-genome sequencing was performed for 69 rice plants, 34 of which were 
edited with the Cas9, 15 with Cpf1, and 20 were used as the control [41]. It was found out that 
almost all mutations (from 102 to 148 single nucleotide substitutions and from 32 to 83 indels …",https://link.springer.com/article/10.1134/S0026893320010069,"GA Gerashchenkov, NA Rozhnova, BR Kuluev… - Molecular Biology, 2020 - Springer",2020
Genome sequencing and carbohydrate-active enzyme (CAZyme) repertoire of the white rot fungus Flammulina elastica,"… For instance, genome sequencing of the white rot basidiomycete Phanerochaete 
chrysosporium revealed a larger repertoire of plant biomass-… Here, for the first time, we report 
the genome sequence of F. elastica. The aim of this study was to identify CAZyme genes in the …",https://www.mdpi.com/326796,"YJ Park, YU Jeong, WS Kong - International journal of molecular sciences, 2018 - mdpi.com",2018
Constructing a reference genome in a single lab: The possibility to use oxford nanopore technology,"… of gaps or covering the repetitive sequence that appears on the plant genome. Here, we 
conducted the genome sequencing for S. bicolor cv. … We did not perform the Illumina sequencing 
in this study, since the sorghum genome sequence was already released. However, the de …",https://www.mdpi.com/510326,"YG Lee, SC Choi, Y Kang, KM Kim, CS Kang, C Kim - Plants, 2019 - mdpi.com",2019
Plant genome database japan (PGDBj),"… sequencing and bioinformatics have enabled the genome sequencing of a variety of plant 
species, including model plants and crop species with more complex genome … Genome 
sequencing and related projects for various plant species have been performed since the 1990s in …",https://link.springer.com/protocol/10.1007/978-1-4939-6658-5_3,"A Nakaya, H Ichihara, E Asamizu, S Shirasawa… - Plant Genomics …, 2017 - Springer",2017
Whole-genome sequencing and intensive analysis of the undomesticated soybean (Glycine soja Sieb. and Zucc.) genome,"… The genomes of more than 10 plant species have been sequenced so far (5). Among them, 
6 species, rice (Oryza sativa) (6), grapevine (Vitis vinifera) (7), sorghum (Sorghum bicolor) 
(8), cucumber (Cucumis sativus) (9), maize (Zea mays) (10), and soybean (G. max) (11), are …",https://www.pnas.org/content/107/51/22032.short,"MY Kim, S Lee, K Van, TH Kim… - Proceedings of the …, 2010 - National Acad Sciences",2010
Harvesting the promising fruits of genomics: applying genome sequencing technologies to crop breeding,"… used for de novo sequencing, whole genome sequencing (WGS), whole genome re-sequencing 
(WGRS), genotyping by … sequence the genomes of a number of crops. Here we provide a 
brief update on these technologies and their use in sequencing the genomes of key plant …",https://journals.plos.org/plosbiology/article?id=10.1371/journal.pbio.1001883,"RK Varshney, R Terauchi, SR McCouch - PLoS biology, 2014 - journals.plos.org",2014
A workshop report on wheat genome sequencing: International Genome Research on Wheat Consortium,"… Department of Agriculture, a wheat genome sequencing workshop was held November 10–… 
genome sequencing projects, and develop strategies for sequencing the wheat genome. The 
… point of view, sequencing the wheat genome will facilitate annotation of all plant genomes, …",https://academic.oup.com/genetics/article-abstract/168/2/1087/6059628,"BS Gill, R Appels, AM Botha-Oberholster, CR Buell… - Genetics, 2004 - academic.oup.com",2004
A large-scale whole-genome sequencing analysis reveals highly specific genome editing by both Cas9 and Cpf1 (Cas12a) nucleases in rice,"… Through sequencing 20 control plants of different types and 49 Cas9 or Cpf1-edited T0 
and T1 plants, we only found true off-target mutations in two T0 lines expressing Cas9 protein 
with Cas9-J-sgRNA01. Importantly, these empirically validated off-target sites can be readily …",https://link.springer.com/article/10.1186/s13059-018-1458-5,"X Tang, G Liu, J Zhou, Q Ren, Q You, L Tian, X Xin… - Genome Biology, 2018 - Springer",2018
One ring to rule them all? Genome sequencing provides new insights into the 'master circle'model of plant mitochondrial DNA structure,The in vivo molecular structure of plant mitochondrial DNA (mt DNA) has been a long‐standing source of intrigue and controversy. Recent deep sequencing analyses of mitochondrial genomes from numerous plant species have provided the opportunity to …,https://nph.onlinelibrary.wiley.com/doi/abs/10.1111/nph.12395,"DB Sloan - New Phytologist, 2013 - Wiley Online Library",2013
Genome-wide association study using whole-genome sequencing rapidly identifies new genes influencing agronomic traits in rice,"… To confirm the effect of this gene on heading date, we introduced the entire genome 
sequence of haplotype A and B into Nipponbare carrying haplotype A. The plants transformed 
with haplotype A showed no phenotypic change, whereas plants transformed with haplotype B …",https://www.nature.com/articles/ng.3596,"K Yano, E Yamamoto, K Aya, H Takeuchi, P Lo, L Hu… - Nature …, 2016 - nature.com",2016
Genome sequencing in microfabricated high-density picolitre reactors,"The proliferation of large-scale DNA-sequencing projects in recent years has driven a search for alternative methods to reduce time and cost. Here we describe a scalable, highly parallel sequencing system with raw throughput significantly greater than that of state-of-the …",https://www.nature.com/articles/nature03959,"…, EW Myers, E Nickerson, JR Nobile, R Plant… - Nature, 2005 - nature.com",2005
Sorghum genome sequencing by methylation filtration,"… Additionally, we conducted a simulation in Arabidopsis to assess the expected gene 
identification rate in a completed plant genome where the level of coverage could be controlled 
precisely in silico (see Expected Gene Tagging, below). The results of these analyses are …",https://journals.plos.org/plosbiology/article?id=10.1371/journal.pbio.0030013,"JA Bedell, MA Budiman, A Nunberg, RW Citek… - PLoS …, 2005 - journals.plos.org",2005
De novo genome sequencing and comparative genomics of date palm (Phoenix dactylifera),"… the availability of a draft genome sequence. Despite the limitations of … plants have fewer 
repeat sequences within genes than in extragenic regions. In terms of a framework used to 
classify the quality of plant genome assemblies 45 , we regard this as a high-quality draft genome, …",https://www.nature.com/articles/nbt.1860?referral=true,"EK Al-Dous, B George, ME Al-Mahmoud… - Nature …, 2011 - nature.com",2011
Rosaceaous genome sequencing: perspectives and progress,"… One of the most recent plant genome sequencing strategies that has been developed is 
known as gene enrichment. The first example of this … entire genome sequence for a plant, but 
instead allows for focusing upon gene rich regions (gene space) of the genome for sequencing. …",https://link.springer.com/chapter/10.1007/978-0-387-77491-6_28,"B Sosinski, V Shulaev, A Dhingra… - Genetics and genomics …, 2009 - Springer",2009
The sequenced angiosperm genomes and genome databases,"… Most of them are plants of high economic importance or their wild relatives. More effort should 
be done on genome sequencing of more … After the completion of the genome sequencing, 
an urgent issue is to share the genome data with the research community immediately …",https://internal-journal.frontiersin.org/articles/10.3389/fpls.2018.00418/full,"F Chen, W Dong, J Zhang, X Guo… - … in plant science, 2018 - internal-journal.frontiersin.org",2018
The Amborella genome: an evolutionary reference for plant biology,"… genomic models for woody crop plants [5–12]. These advances have been motivated by the 
realization that understanding the structure and evolution of plant genomes … international 
Amborella genome sequencing initiative in support of fundamental and applied plant sciences, …",https://genomebiology.biomedcentral.com/articles/10.1186/gb-2008-9-3-402,"DE Soltis, VA Albert… - Genome …, 2008 - genomebiology.biomedcentral.com",2008
Single-molecule sequencing of the desiccation-tolerant grass Oropetium thomaeum,"… Here we report the whole-genome sequencing and assembly of the desiccation-tolerant grass 
Oropetium thomaeum. Using only single-… Here we present a several hundred megabase 
plant genome, sequenced and assembled entirely by SMRT sequencing. The long SMRT …",https://www.nature.com/articles/nature15714,"R VanBuren, D Bryant, PP Edger, H Tang, D Burgess… - Nature, 2015 - nature.com",2015
Genome sequencing and identification of gene function in rice,"… As the model cereal crop, large-scale sequencing of rice genome must play quite important 
roles both in theoretical research and practical … In this article, the sequencing and functional 
research of the rice genome were reviewed. These results may provide some useful clues for …",https://www.sciencedirect.com/science/article/pii/S037941720660098X,"LIU Qing-Po, XUE Qing-Zhong - Acta Genetica Sinica, 2006 - Elsevier",2006
Dissection of the octoploid strawberry genome by deep sequencing of the genomes of Fragaria species,"… This is especially true in plant species, for which genomes are relatively large and complex 
in structure compared with non-plant genomes… However, to our knowledge, no reports of 
de novo whole-genome sequencing have been published for any polyploid species. As with …",https://academic.oup.com/dnaresearch/article-abstract/21/2/169/404005,"H Hirakawa, K Shirasawa, S Kosugi, K Tashiro… - DNA …, 2014 - academic.oup.com",2014
