title,content,url,sub_title,year
云南三种稻蝗基因组DNA 的RAPD 多态性分析,"应用RAPD 技术对采自云南龙陵两交水和腾冲曲石马鹿冲的24 头稻蝗进行了基因组DNA 多态性分析, 10 条随机引物共产生129 条清晰, 稳定的谱带. 基于Jaccard 相似系数, 用Between-groups Linkage 法得出的聚类图与基于Nei's 遗传距离分别用UPGMA 和NJ …",http://www.cqvip.com/qk/90158x/200503/20000047.html,"张建珍， 郭亚平， 张敏， 欧晓红， 马恩波 - 动物分类学报, 2005 - cqvip.com",2005
动物适应性进化研究的新视角: 动物肠道微生物组,"… 自身也进化出很强的短链脂肪酸吸收和运输的 能力, 进而从能量代谢角度揭示了高原哺乳动物
“第 一套基因组”(自身基因组)和“第二套基因组”… 动物在其基因组层面的趋 同进化外, 更重要的是
发现动物共生肠道微生物组 的结构和功能的趋同进化是哺乳动物高原适应的另 一种新机制, 为动物…",http://159.226.67.71/bitstream/000000/12388/1/%E5%8A%A8%E7%89%A9%E9%80%82%E5%BA%94%E6%80%A7%E8%BF%9B%E5%8C%96%E7%A0%94%E7%A9%B6%E7%9A%84%E6%96%B0%E8%A7%86%E8%A7%92_%E5%8A%A8%E7%89%A9%E8%82%A0%E9%81%93%E5%BE%AE%E7%94%9F%E7%89%A9%E7%BB%84.pdf,魏辅文 - 2016 - 159.226.67.71,0
布鲁氏菌全基因组DNA 芯片研制及比较基因组杂交方法的建立,"… （B.abortus）9-941全基因组序列,构建布鲁氏菌全基因组DNA芯片,并将其应用于比较基因组学
分析,从基因库下载… 基因组杂交分析方法。若干质控杂交结果表明,建立的全基因组DNA芯片杂交
结果与全基因组测序结果完全一致。证明成功建立了基于全基因组DNA芯片的布鲁氏菌比较基因组…",http://www.cqvip.com/qk/93994a/2011012/40418833.html,"钟志军， 徐杰， 于爽， 王玉飞， 周冬生， 汪舟佳， 杜昕颖… - 中国兽医科学, 2011 - cqvip.com",2011
颈链血苔虫线粒体基因组的测定及其系统发育学意义,"… 基因组所有的基因都编码在同一条链上。相比其他后生动物它具有独特的基因排列顺序，而且与
已发表的两个苔藓动物线粒体基因组相比，基因排列顺序也显著不同，这说明苔藓动物线粒体基因组
… 支持苔藓动物为原口动物的观点，提示我们基因排列顺序的比较分析可能会成为苔藓动物门…",http://www.cqvip.com/qk/90269a/201001/33079317.html,"孙名安， 吴志刚， 申欣， 任建峰， 刘锡兴， 刘斌， 刘会莲 - 渔业科学进展, 2010 - cqvip.com",2010
宏基因组基因集构建方法及其应用研究,"… 加深了我们对不同饲料添加剂对动物生长促进的认识。将此方法应用在入侵动物福寿螺宏基因组
项目中,我们构建了第一个蜗牛类动物的宏基因组基因集。该宏基因集中的微生物功能基因为福寿螺
在重金属污染等逆境中的解毒起到了重要作用,是对福寿螺基因组功能的重要补充。在本项目…",https://cdmd.cnki.com.cn/Article/CDMD-82101-1019108002.htm,王恒超 - 2019 - cdmd.cnki.com.cn,0
全基因组选择及其在奶牛育种中应用进展,"… 的分子标记,利用基因组水平的遗传信息对个体进行遗传评估,以期获得更高的育种值估计准确度
。由于可显著缩短世代间隔,全基因组选择作为一… ,如果代替常规后裔测定体系,可节省92%的育种
成本。本文综述了全基因组选择的基本原理及其在各国奶牛育种中的应用现状和所面临的问题。 …",http://www.cqvip.com/qk/98003x/201120/39921290.html,"范翌鹏， 孙东晓， 张勤， 张胜利， 张沅， 刘林 - 中国奶牛, 2011 - cqvip.com",2011
植物基因组编辑及衍生技术最新研究进展,"… : 基因组编辑技术已经在多个模式植物、动物以及其他生物中得到成功应用。基因组编辑是利用
序列特异 核酸酶(Sequence-specific nucleases, SSNs)在基因组… 和 表观调控等衍生技术。本文
从基因组编辑技术的原理与优势、SSNs 组成及构建方法、基因组编辑及衍生技术 在植物中应用、…",http://www.chinagene.cn/CN/10.16288/j.yczz.15-156,"单奇伟， 高彩霞 - 遗传, 2015 - chinagene.cn",2015
镁在基因组稳定中的作用,"… 摘要：在细胞内生理浓度下的镁(Mg2+)是保持基因组稳定性的重要因素,它能稳定DNA及染色
质结构,是参与DNA合成和分解过程中酶系统必要辅助因子.也作为核苷切除修复、碱基切除修复及
错配修复过程中的辅助因子.动物实验及流行病学研究表明,镁的缺乏会影响细胞膜的完整性及其…",http://www.cqvip.com/qk/93937x/2003003/8527255.html,"姚嘉宜， 刘利英， 宋土生 - 国外医学: 医学地理分册, 2003 - cqvip.com",2003
贵州小型香猪基因组DNA 的AFLP 检测研究,"摘要: 报道了AFLP 标记在研究贵州小型香猪遗传多态性方面的应用和该品系猪个体基因组DNA 
的AFLP 扩增结果, 分析了贵州小型香猪的群体遗传结构. 实验应用10 条AFLP 引物, 用PszT 酶
切, 对17 头猪基因组DNA 进行AFLP 反应, 共获得116 个AFLP 标记. 单引物获得的标记数在2~ …",http://www.chinagene.cn/CN/article/downloadArticleFile.do?attachType=PDF&id=548,"吴丰春， 魏泓， 甘世祥， 周建华， 马静 - 遗传, 2001 - chinagene.cn",2001
类猪圆环病毒2 型因子P1 与P2 株全长基因组DNA 分子克隆的构建,"… 摘要：依据类猪圆环病毒2型（PCV2）因子P1与P2株全基因组序列，设计1对引物，应用PCR技术
扩增全基因组DNA片段，分别克隆到pMD18-T载体后，再克隆到pBluescript SK载体，获得两因子
全长基因组单拷贝DNA分子克隆和双拷贝串联分子克隆。为进一步研究类PCV2因子P1与P2的…",http://www.cqvip.com/qk/92499x/200706/26309485.html,"温立斌， 何孔旺， 杨汉春 - 江苏农业学报, 2007 - cqvip.com",2007
中国濒危兽类保护基因组学和宏基因组学研究进展与展望,"… ,为揭示濒危物种的演化历史,遗传结构,适应性演化及 其与肠道微生物的协同演化的分子机制
提供了重要的技术支撑,由此产生了保护基因组学和保护宏基因组学两 个分支学科,为野生动物尤其
是濒危动物的保护生物学研究提供了新的方向与思路.本文综述了我国在保护基 因组学和保护宏…",http://www.mammal.cn/CN/abstract/abstract3499.shtml,"魏辅文， 黄广平， 樊惠中， 胡义波 - 兽类学报, 2021 - mammal.cn",2021
水貂犬瘟热CDV3 疫苗株基因组序列测定及H 基因遗传稳定性分析,"对水貂犬瘟热CDV3 疫苗株基因组进行全序列测定与分析, 以阐明该疫苗株的来源亲本毒株, 基因特征及H 基因遗传稳定性. 将CDV3 疫苗株基因组cDNA 分9 个重叠片段进行RT-PCR 并克隆入pMD 18-T 载体中, 测定全长cDNA 序列. 并与CDV 野毒参考株和疫苗株N, F 和H …",http://www.cqvip.com/qk/93358a/200901/29759078.html,"赵建军， 柴秀丽， 王凤雪， 邵西群， 陈涛， 罗国良… - 经济动物学报, 2009 - cqvip.com",2009
果蝇基因组DNA 制备,"… 摘要:主要介绍快速简单制备果蝇的基因组DNA 的方法,可以为后续的实验比如基因 扩增提供高
质量… 动物基因组DNA 抽提试剂盒(生工生物工程(上海)有限公司, catalog number: B518221) … 
1.1 通常动物组织完全裂解需要1~3 小时,取样过多会影响提取DNA 的质量. 1.2 水浴过程中,每10 …",https://bio-protocol.org/pdf/Bio-protocol1010253.pdf,"邓娟， 刘南 - Bio-protocol, 2019 - bio-protocol.org",2019
抗叶酸代谢药MTX 诱导神经管畸形动物模型及其对基因组稳定性的影响,"正目的: 利用抗叶酸代谢药MTX 建立叶酸缺乏及相关代谢障碍的神经管畸形(NTDs) 小鼠模型, 并初步探讨NTDs 发生的分子机制. 方法: C57BL/6 孕鼠在怀孕第7.5 天腹腔注射不同剂量的MTX, 怀孕第11.5 天处死孕鼠, 根据实验结果筛选最佳造模剂量; 用微阵列比较基因组杂交芯片 …",https://cpfd.cnki.com.cn/Article/CPFDTOTAL-IGSS201108004106.htm,"关涛， 赵婕， 牛勃 - 泛环渤海地区九省市生物化学与分子生物学会 …, 2011 - cpfd.cnki.com.cn",2011
中科院动物所开发新型基因组编辑工具CRISPR/Cas12b,"中科院动物所开发新型基因组编辑工具CRISPR/Cas12b-【维普官方网站】-www.cqvip.com-维普
网 … 中科院动物所开发新型基因组编辑工具CRISPR/Cas12b … 中科院动物所开发新型基因组
编辑工具CRISPR/... …",http://www.cqvip.com/qk/90812a/201824/6100130729.html,"本刊讯 - 首都食品与医药, 2018 - cqvip.com",2018
基于重测序揭示猪基因组中的选择信号,"… 基因组上留下明显的特征,即选择信号。检测驯养动物的选择信号对于阐明自然和人类技术在进化
过程中的参与及二者共同影响现代动物基因组、… 质特性的遗传基础。皖南黑猪全基因组遗传变异
及选择信号检测:20头皖南黑猪共得到501.52G原始数据,平均每个个体测序深度达到9.43X,平均…",https://cdmd.cnki.com.cn/Article/CDMD-10364-1019226310.htm,张威 - 2019 - cdmd.cnki.com.cn,0
基因组编辑技术研究新进展,"… 基因组编辑是一种针对目的基因组进行定点改造的技术，其主要方法是通过对目的基因组的改 造
，从而达到对未知功能基因进行研究和基因治疗的目的。人工核酸内切酶介导的基因组… 的优缺点
，并对不同生物中基因组编辑技术的 研究现状进行了总结，对疾病模型动物的建立中的应用作了…",http://ir.nsfc.gov.cn/paperDownload/1000013798600.pdf,"毛超， 陶永光 - 生命的化学, 2015 - ir.nsfc.gov.cn",2015
布尼亚病毒科全基因组序列比对分析,"… 农业上的重要病毒。本文从NCBI数据库下载具有完整基因组序列的布尼亚科病毒的5个属20种… 
与动物病毒有很大差异：（1）只有植物病毒的M基因组能编码NSm运动蛋白；（2）植物病毒和动物… 
含量低于动物病毒；（4）通过SMART网络软件进行蛋白质拓扑结构分析发现植物病毒和动物病毒在…",http://www.cqvip.com/qk/94499a/2008003/27231348.html,"刘雅婷， 张文超， 李正跃， 李成云， 朱有勇… - … 农业大学学报: 自然科学版, 2008 - cqvip.com",2008
疾病基因组学,"本书是2006年10月2~4日在美国Missouri—Columbia大学举行的第24届斯塔德勒遗传学研讨会
(Stadler Genetics Symposium Series)的论文集,概括总结了在动植物疾病基因组学研究方面取得
的最新进展.本书内容同时涵盖了动物疾病和植物疾病两方面的关键研究领域,可为本研究领域…",http://www.cqvip.com/qk/88019x/200809/28393585.html,"吴少伟 - 国外科技新书评介, 2008 - cqvip.com",2008
功能基因组学研究进展,"… 基因组学概况基因组这一概念于1924年提出，用于描述一种生物的全部基因和染色体组成。基因组
学（genomics）由美国科学家Thomas Roderick于1986年提出，是指对基因组… 新创刊的杂志名
。结构基因组学（structural genomics）代表基因组分析的早期阶段，是基因组学的一个重要组成…",http://www.cqvip.com/qk/95987b/200803/26675574.html,"高锐， 臧春龙， 张传东 - 畜牧兽医科技信息, 2008 - cqvip.com",2008
细胞核中基因组的组织和功能,"… 摘要：通过具有清晰和明确的逻辑的叙述，以及丰富的高分辨率插图，本书系统地阐述了在哺乳
动物细胞核中控制基因组功能的角色和途径。并从多个学科，剖析所有的主要基因组事件：复制
、重组、修复和转录。特别强调的是转录控制，包括全基因组的相互作用和非编码RNA、染色质的表…",http://www.cqvip.com/qk/88019x/201204/42758785.html,"鲁敏 - 国外科技新书评介, 2012 - cqvip.com",2012
DNA 甲基化与克隆动物的发育异常,"… 胎儿肥大、胎盘肥大、多趾、溶血、皮肤皱褶粗糙 等等。克隆动物后代的这些异常表型与其重构胚
早 期发育过程中的异常表观重编程有关。所谓表… 表达, 从而引起克隆动物的诸多异常表型。 DNA 
甲基化是脊椎动物基因组表观遗传修饰的主 要形式之一, 它对哺乳动物发育相关基因的正确表 …",http://www.chinagene.cn/CN/Y2007/V29/I9/1043,"杨荣荣， 李相运 - 遗传, 2007 - chinagene.cn",2007
Taurine 牛基因组序列图: 反刍动物生物学及其进化论的窗口,"为了理解反刍动物的生物学和进化论, 牛的基因组图被测定出有大约7 倍区域(Genome sevenfold coverage). 整个序列含有最低限度22000 个基因, 有一套核心基因14345 个, 是7 个哺乳动物种共享拥有的源祖同源基因或直系同源基因(Ortholog), 其中有1217 …",http://www.cqvip.com/qk/88455x/201010/35733915.html,"何忠武， 杨金旭 - 中国畜禽种业, 2010 - cqvip.com",2010
"西施舌(软体动物, 双壳纲) 线粒体基因组分析","正线粒体全基因组在揭示后生动物精确的演化关系中发挥着很重要的作用. 目前在GenBank 可检索到的软体动物线粒体基因组100 多个, 其中双壳类线粒体基因组44 个(占33.3%), 分布在5 个目9 个科中, 帘蛤目的有鸟蛤科, 截蛏科和满月蛤科4 个科9 个种类. 蛤蜊科是帘蛤目的一个 …",https://cpfd.cnki.com.cn/Article/CPFDTOTAL-ZGHI201111002220.htm,"孟学平， 申欣， 赵娜娜， 程汉良， 阎斌伦… - … 动物学会· 中国海洋 …, 2011 - cpfd.cnki.com.cn",2011
我国人类功能基因研究策略探讨,"… 基因组计划在2003年完成了全序列图的绘制.至2004年5月,第6、7、9、10、13、14、19、20、21、22号
染色体和Y染色体的精确序列和注释已经公布[1],其他物种的全基因组序列分析工作也正在不断
加速进行.目前GenBank的哺乳动物基因组… 研究的重点已经转向功能基因组学,这一领域研究…",http://www.cqvip.com/qk/93850x/200418/10879619.html,"马大龙 - 中华医学杂志, 2004 - cqvip.com",2004
中国6 种经济鱼类的基因组大小测定,"… 实验结果并结合其他鱼类的基因组大小资料,对鱼类基因组大小与其染色体数目及进化地位之
间的相关性进行了探讨,对比分析显示,鱼类进化地位越高则DNA含量越少,同时鱼类基因组的大小
差异存在复杂性,并不完全与染色体数目相关。本研究还就鱼类基因组大小的测定方法等问题提出…",http://www.cqvip.com/qk/98270x/201004/34630971.html,"高静， 黄晓红， 曾华嵩， 尤颖哲， 丁少雄 - 中国水产科学, 2010 - cqvip.com",2010
中国明对虾基因组小卫星重复序列分析,"通过对中国明对虾基因组随机DNA 片断的测序, 我们获得了总长度约641 000 个碱基的基因组DNA 序列, 从中共找到1 720 个重复序列. 其中, 小卫星序列的数目为398 个, 占重复序列总数目的23.14%. 这些小卫星序列的重复单位长度为7-165 个碱基, 集中分布于7-21 …",http://www.cqvip.com/qk/94056x/2005001/12060412.html,"高焕， 孔杰 - 动物学报, 2005 - cqvip.com",2005
鸡胫长和胫围的全基因组关联分析,"… 场鸡F2资源群体为基础,测定了F2代个体93日龄的体重、胫长和胫围,并利用60KSNP芯片对
个体基因组DNA进行分型,进行胫长和胫围的全基因组关联分析（GWAS）。结果表明,与鸡胫长和胫
围达到5%全基因组水平显著关联位点分别为1个和4个（P〈2.98×10-6）,潜在关联位点分别为4个和…",http://www.cqvip.com/qk/91152x/201303/45154122.html,"孙艳发， 刘冉冉， 郑麦青， 赵桂苹， 张磊， 吴丹， 胡耀东… - 畜牧兽医学报, 2013 - cqvip.com",2013
基因组,"… 基因组学的新观点与研究基因表达的传统方法相结 合,为基因组作为生命蓝图所起的重要作用
提供了最新理解。全书从四个 方面展开论述,分别为:基因组、转录组和蛋白质组,基因组研究,基因组
功 能和基因组… 所有多细胞动物的代表,人类基因组由两个独立的部分组成(图1 1):  核基因组(…",http://www.ecsponline.com/yz/BE6B5D3EDC181411EAAF9A7A987583DC1000.pdf,袁建刚， 周严， 强伯勤 - 2006 - ecsponline.com,0
寄生虫基因组学研究进展,"寄生虫病严重危害人和动物的健康, 但目前防治寄生虫病尚存在困难, 随着分子生物学技术的迅速发展, 运用分子生物学技术手段来控制寄生虫病将成为可能. 本文主要介绍寄生虫基因的组成及特征, 目前的测序现状, 基因组测序, 分析, 基因功能及蛋白质组的研究技术等 …",https://www.airitilibrary.com/Publication/alDetailedMesh?docid=10007083-200911-200911300007-200911300007-941-944,"陈涛， 任晓燕， 尤平 - 四川動物, 2009 - airitilibrary.com",2009
转基因羊的研究进展,"… ，将外源DNA整合到动物基因组中，使其能够稳定遗传给下一代。2006年6月2日，GTC生物治疗
公司利用转基因羊生产的重组人抗凝血酶Ⅲ——“ATryn”获得欧洲药品局的认证并批准上市，这
不仅是转基因羊研究领域的重大突破，也标志着历经20多年的转基因动物研究进入成熟阶段，产业…",http://www.cqvip.com/qk/96216x/2008012/28967169.html,"张宝路， 连正兴 - 黑龙江畜牧兽医, 2008 - cqvip.com",2008
基因营养学与营养基因组学研究在动物营养学研究中的应用,"… 基因营养学与营养基因组学研究在动物营养学研究中的应用 … 江西农业大学动物科技学院 … 
摘要：营养物质是所有动物延续生命、生产产品和保持健康所必不可少的一类重要物质,可影响
基因结构的稳定性并调控基因的表达, …",http://www.cqvip.com/qk/97228x/201102/37460234.html,"何余湧， 刘波 - 江西畜牧兽医杂志, 2011 - cqvip.com",2011
蜜蜂基因组研究进展,"… 其简单的脑部结构和卓越的学习记忆能力又为神经生物学家提供了绝好的研究模型，此外，蜜蜂
可以成为免疫、过敏、精神疾病和长寿等试验的研究模型。本文从蜜蜂的基因组序列、基因组结构
、发育、级型分化及繁殖衰老、基因调节、群体遗传学等方面综述了蜜蜂基因组研究的最新进展。 …",http://www.cqvip.com/qk/94007a/200704/24323950.html,"蔡芳， 苏松坤， 钟伯雄， 陈盛禄 - 中国蜂业, 2007 - cqvip.com",2007
西伯利亚蝗基因组DNA 提取及RAPD 分析条件的优化,"… :25舻LPcR反应体系,10×bufier2.5μL;dNTP0.24mmol/L;MgCl2 2.0mmol/L;Taq DNA聚合酶
1U:DNA模板45ng;引物30ng.扩增程序为:94℃预变性lmin45 s,94℃变性30 s,35℃退火1 min30 
s,72℃延伸2 min,45个循环,72℃延伸10min.结果表明,利用优化的反应条件进行西伯利亚蝗基因组…",http://www.cqvip.com/qk/94734x/200704/25025282.html,"葛风伟， 季荣， 曾献春， 王婷， 王小平 - 昆虫知识, 2007 - cqvip.com",2007
三种严重影响人和动物健康的弓首蛔虫线粒体基因组的研究,"正目的线粒体基因组学的研究在许多领域都有重要的应用意义, 包括线粒体的生物化学, 生理学和分子生物学等等. 此外, 线粒体基因的序列还给研究生物群体遗传结构, 分子分类和系统的发生提供了有用的遗传标志. 犬弓首蛔虫, 猫弓首蛔虫和马来西亚弓首蛔虫 …",https://cpfd.cnki.com.cn/Article/CPFDTOTAL-ZGXJ200811002180.htm,"李明伟， 林瑞庆， 宋慧群， 吴湘云… - 第二届全国人畜共患病学术 …, 2008 - cpfd.cnki.com.cn",2008
猪瘟病毒石门株基因组全长cDNA 的克隆与序列分析,"… 摘要：参照已发表的猪瘟病毒基因组序列设计合成了9对引物，通过RT-PCR从感染猪瘟病毒的猪
全血中扩增得到了覆盖猪瘟病毒石门株基因组… ，经测序和拼接后，获得了猪瘟病毒石门株基因组
全序列。序列分析表明，猪瘟病毒石门株基因组全长12297个碱基，含有一个大的开放阅读框架，…",http://www.cqvip.com/qk/90588a/20063/21803382.html,"李国新， 李娜， 仇华吉， 朱庆虎， 李艳， 王明杰… - 中国预防兽医 …, 2006 - cqvip.com",2006
马麝线粒体基因组及麝科动物的系统发育,"虽然过去很多学者对鲸偶蹄目动物的系统发育做了大量的工作, 但是鲸偶蹄目内各科之间, 特别是麝科动物在反刍亚目中的进化位置至今没有得到很好的解决. 为了进一步探讨和解决这些问题, 我们用引物步移法测定了马麝(Moschus chrysogaster) 的线粒体基因组. 同时 …",https://cpfd.cnki.com.cn/Article/CPFDTOTAL-DWLP201206001029.htm,"杨承忠， 刘梦瑶， 纪维雯， 张修月… - 中国西部动物学学术研讨会 …, 2012 - cpfd.cnki.com.cn",2012
"三个动物源性链球菌新种的发现, 基因组及毒力基因分析","本课题围绕“动物源病原体的发现及其对人类致病性” 这一科学问题, 以我国青藏高原喜马拉雅旱獭呼吸道携带的病原体谱系为研究目标, 将现场流行病学调查与实验室检测分析相结合, 采用PacBio 高通量测序技术, 微生物培养组学技术和未知新病原鉴定技术相结合 …",https://cdmd.cnki.com.cn/Article/CDMD-10108-1017302481.htm,"牛莉娜 - 山西大学, 2017 - cdmd.cnki.com.cn",2017
哺乳动物NMDA 受体NR3 亚基的比较基因组学研究,"目的: 通过比较基因组学方法对哺乳动物NR3 亚基进行分析, 探讨其种间功能及结构差异, 并预测其功能. 方法: 应用人类NR3A 和NR3B 所编码氨基酸序列作为检索探针, 通过TBLASTN 检索数据库, 并应用生物软件进行进化分析及序列对比. 结果: 共检索到30 个哺乳动物NR3A …",http://www.cqvip.com/qk/84220a/201228/43658380.html,"李响， 黄长盛， 郭曲练 - 现代生物医学进展, 2012 - cqvip.com",2012
龟鳖类线粒体全基因组的比较研究,"… 摘要: 在基因组水平上, 比较分析了已登录GenBank 的19 种龟鳖类线粒体全基因组的结构
特征. 结果表明: 1) 除平胸龟、扁陆龟外, 其余17 种龟鳖类线粒体基因组结构、基因排列顺序均与
典型的脊椎动物相似, 显示龟鳖类 线粒体基因组在进化上十分保守: 2) 19 种龟鳖类线粒体全…",https://smkx.hunnu.edu.cn/CN/article/downloadArticleFile.do?attachType=PDF&id=542,"张莉， 聂刘旺 - 生命科学研究, 2007 - smkx.hunnu.edu.cn",2007
DNA 甲基化的研究进展,"… 摘要：甲基化修饰是脊椎动物DNA唯一的自然修饰方式，动物基因组甲基化与基因表达密切
相关。DNA甲基化通过与反式作用因子相互作用或通过改变染色质结构而影响表达，在细胞分化
、发育、X染色体失活、基因组印记及肿瘤发生发展中起重要作用。 …",http://www.cqvip.com/qk/84220a/200917/31851901.html,"谢松松， 王宝峰， 周宗瑶 - 现代生物医学进展, 2009 - cqvip.com",2009
基因组选择技术在农业动物育种中的应用,"基因组选择(genomic selection, GS) 是畜禽经济性状遗传改良的重要方法. 随着高密度SNP 芯片和二代测序价格的下降, GS 技术越来越多被应用于奶牛, 猪, 鸡等农业动物育种中. 然而, 降低全基因组SNP 分型成本, 提高基因组育种值(genomic estimated breeding value, GEBV) …",http://www.chinagene.cn/EN/abstract/abstract5211.shtml,"谈成， 边成， 杨达， 李宁， 吴珍芳， 胡晓湘 - 遗传, 2017 - chinagene.cn",2017
营养基因组学研究与应用,"… 摘 要：营养基因组学是高通量基因组技术在日粮营养素与基因组互作及其与健康关系研究中的 
应用．随着人类和模式动物基因组的阐明以及近年… 疾病早期调节失控与基因型的关系．应用营养
基因组学建立 评价营养素利用效率的标识和方法，可为公众健康提供有效的科学依据．利用营养…",http://spyswjs.cnjournals.com/ch/reader/create_pdf.aspx?file_no=20040372&year_id=2004&quarter_id=3&falg=1,"乐国伟， 施用晖 - 无锡轻工大学学报, 2004 - spyswjs.cnjournals.com",2004
动物基因组学在畜禽改良中的应用以及对信息技术的需求,"测序技术的飞速发展使得动物基因组学开始向应用层面拓展, 基因组大数据时代的来临不仅为现代畜禽遗传学研究带来了新的挑战, 同时也提供了新的机遇. 本文就基因组选择, 基因组编辑, 信息管理三个方面, 具体讨论动物基因组学在畜禽改良中的需求以及所面临的问题 …",https://cpfd.cnki.com.cn/Article/CPFDTOTAL-ZGXJ201708001033.htm,"朱峰， 侯卓成 - 中国畜牧兽医学会信息技术分会第十二届学术研讨会 …, 2017 - cpfd.cnki.com.cn",2017
福尔马林保存的动物标本基因组DNA 的提取方法,"从在福尔马林长期保存的动物物标本中提取基因组DNA 用于分子生物学研究一直是一个未得到彻底解决的难题. 本文提出了一种从浸泡在福尔马林的大仓鼠肝脏和日本鳗鲡肌肉标本中提取基因组DNA 的新方法. 取浸泡于福尔马林中的大仓鼠肝脏或日本鳗鲡肌肉适量, 用PBS …",http://www.cqvip.com/qk/94056x/200202/6196915.html,"徐来祥， 张知彬， 宋铭晶， 曹小平， 王福生， 张春光 - 动物学报, 2002 - cqvip.com",2002
