title,content,url,sub_title,year
猪基因组AFLP 指纹图谱的构建,"摘要: 对猪() 基因组AFLP 指纹图谱构建的各项条件进行了优化, 包括双酶切消化, 接头连接, 预扩
增和选择性扩增, 凝胶电泳银染技术及荧光标记检测法等, 建立了稳定的猪基因组DNA 的AFLP 
指纹图谱构建方法, 采用E32/T32 引物组合在45 个猪种基因组混合DNA 中检测到28 个多态标记…",http://journal05.magtech.org.cn/Jwk_ny/CN/article/downloadArticleFile.do?attachType=PDF&id=9896,"任军， 黄路生 - 农业生物技术学报, 2003 - journal05.magtech.org.cn",2003
哺乳动物线粒体基因组转录因子研究进展,"正线粒体基因组(mtDNA) 是哺乳动物细胞中具有双链闭合环状结构的核外遗传物质, mtDNA 转录受核基因编码蛋白质调控, 同时mtDNA 也会影响核基因表达. mtDNA 转录对调控线粒体功能具有重要作用, mtDNA 突变或者转录异常会造成线粒体功能障碍 …",https://cpfd.cnki.com.cn/Article/CPFDTOTAL-ZGXJ201208004178.htm,"陈晓勇， 敦伟涛 - 中国畜牧兽医学会动物繁殖学分会第十六届学术 …, 2012 - cpfd.cnki.com.cn",2012
动物行为学在现代生命科学研究中的应用,"… 动物行为学是专门研究动物行为的学科,最早 是由于人们对动物行为的好奇心而开始研究的.随 
着人类社会和经济的发展,动物行为学逐渐与多个 学科发生了相关性.20世纪以来.生命科学发展
迅 速.尤其是人类基因组以及功能基因组研究的开展, 食得对动物行为学的研究不仅显得更加重要,…",http://www.slarc.org.cn/dwyx/CN/article/downloadArticleFile.do?attachType=PDF&id=3308,"金玫蕾 - 实验动物与比较医学, 2008 - slarc.org.cn",2008
牛基因组中有利于ΦC31 整合酶介导的外源基因高效表达位点的研究,"… 介导携带attB 序列的重组载体在人、鼠等动物基因组中实现高效定点整合,染色体上的整合位点
称为假attP 位点。假attP 位点广泛存在于多种物种的动物基因组中,而且每个物种往往存在着多个
假attP 位点,如人基因组中存在着约100多个假attB 位点,小鼠基因组中约有57个。另外在大鼠、兔…",https://cpfd.cnki.com.cn/Article/CPFDTOTAL-ZGYL200810001274.htm,"欧海龙， 曲立娟， 许淼， 蔡勤， 巩芷娟… - 中国遗传学会第八次 …, 2008 - cpfd.cnki.com.cn",2008
动物遗传标记辅助选择研究及其应用,"… 摘要：随着分子数量遗传学及其相关学科的发展,有关动物遗传标记辅助选择方面的研究也在不断
深入,且已经在动物遗传改良中有了一些成功… 上也取得了不少喜人的成果.本文综述了动物遗传
标记辅助选择研究的一些进展,并对标记辅助选择在动物遗传改良中应用的有关问题进行了讨论. …",http://www.cqvip.com/qk/92614x/2002003/6416635.html,"鲁绍雄， 吴常信 - 遗传, 2002 - cqvip.com",2002
不同保存方法的大黄鱼肌肉样品基因组DNA 提取及RAPD 分析,"以-20℃冷藏,70%(V/V)乙醇,含50mmol/dm^3 EDTA的70%(V/V)乙醇和10%(V/V)福尔马林保存
等方法处理大黄鱼肌肉样品,进行了DNA的提取及RAPD分析,并与新鲜样品作了对照.实验结果
表明,鲜活样品以及冷冻保存,70%(V/V)乙醇以及含50mmol/dm^3EDTA的70%(V/V)乙醇保存的…",http://www.cqvip.com/qk/90949x/200203/6559868.html,"张海琪， 薛良义 - 台湾海峡, 2002 - cqvip.com",2002
植物基因组测序的研究进展,"… 不断发展，基因组测序技术渐趋成熟并在动物和植物基因组上获得了越来越 多的成功，大量植物
的基因组的草图和… 基因组组装、注释和比较基因组学等方面的研究进展进行了详细的评述，阐明
了植物基因组研 究的特点和难点。 通过植物的全基因组测序，研究者不仅可以获得该植物基因组…",https://smkx.hunnu.edu.cn/CN/article/downloadArticleFile.do?attachType=PDF&id=1677,"陈勇， 柳亦松， 曾建国 - 生命科学研究, 2014 - smkx.hunnu.edu.cn",2014
哺乳动物血液基因组DNA 提取方法的比较研究,"哺乳动物血液基因组DNA提取方法的比较研究-【维普网】-仓储式在线作品出版平台-www.cqvip.com … 
哺乳动物血液基因组DNA提取方法的比较研究 … 基因组 …",http://www.cqvip.com/qk/96216x/201402/48674507.html,"巴秋爽， 李凤， 刘玉芬 - 黑龙江畜牧兽医, 2014 - cqvip.com",2014
不同固定剂处理的对虾基因组DNA 提取方法研究,"… 摘要：为了从乙醇固定和福尔马林固定的对虾标本中获得高质量的基因组DNA,对标本的预处理
方法以及DNA的提取方法进行了研究。结果表明,75%乙醇作为固定剂更适合用于提取对虾标本
的基因组DNA。对乙醇固定的对虾标本采用PBS溶液和TE溶液进行预处理,获得的DNA得率较高,…",http://www.cqvip.com/qk/92965a/201203/41481660.html,"闫晗， 董君， 黄静， 刘政 - 应用化工, 2012 - cqvip.com",2012
二斑叶螨和肩突硬蜱基因组微卫星分布规律研究,"本研究利用已公布的二斑叶螨Tetranychusurticae 和肩突硬蜱Ixodesscapularis 的全基因组测序结果, 对其基因组中的微卫星序列进行了系统分析和比较. 结果表明: 在二斑叶螨基因组中共找到微卫星7934 个, 出现频率为1/11.45 kb, 占全基因组碱基总数的0.16 …",http://www.cqvip.com/qk/93406x/201304/46587202.html,"汪自立， 黄杰， 杜联明， 李午佼， 岳碧松， 张修月 - 四川动物, 2013 - cqvip.com",2013
"发育阶段相关基因的结构特征, 基因组特征和起源进化","… 密码子偏好使用的新规律,提出了支持自然选择作用于哺乳动物同义位点的新证据。此外,我们的
研究结果对于理解哺乳动物基因的进化历程和哺乳动物基因组GC含量的潜在生物学意义都提供
了新的途径。 这项研究将分子进化的理论分析引入干细胞领域,对于从结构特征的角度,在基因组…",https://cdmd.cnki.com.cn/Article/CDMD-10248-2008052074.htm,任立晨 - 2007 - cdmd.cnki.com.cn,0
番鸭细小病毒和鹅细小病毒生化及基因组特性的比较,"番鸭细小病毒莆田株(MPV-P)和鹅细小病毒莆田株(GPV-P)分别感染的番鸭胚尿囊液经氯仿处理
,PEG沉淀和Sepharose 4B柱纯化.纯化样品在电镜下观察,均见到实心和空心2种病毒粒子.病毒
粒子呈圆形,立体对称,无囊膜,直径为20~24 nm.经SDS-PAGE分析,MPV和GPV均呈现3条结构…",http://www.cqvip.com/qk/93164a/200105/5841277.html,"程由铨， 胡奇林， 陈少莺， 李怡英， 林天龙 - 中国兽医学报, 2001 - cqvip.com",2001
非编码长链RNA 与基因表达调控,"… 摘要：近年来,在小鼠全长cDNA文库大规模测序中发现一类新的转录物——非编码长链RNA（long 
noncoding RNA,lncRNA）,引起了科学界的关注.lncRNA长度大于200个核苷酸,无蛋白质编码
功能,在真核细胞基因组中被普遍转录.lncRNA种类繁多,数量庞大,占哺乳动物基因组转录物的绝…",http://www.cqvip.com/qk/92593a/201209/43170016.html,"史华俊， 刘忠， 郭俊明 - 中国生物化学与分子生物学报, 2012 - cqvip.com",2012
朗德鹅圆环病毒全基因组序列测定和遗传演化分析,"圆环病毒可以引起免疫抑制, 从而造成其他病原的并发和(或) 继发感染. 为研究鹅圆环病毒(Goosecircovirus, GoCV) 全基因组的分子生物学特性, 运用重叠PCR 技术从江西朗德鹅组织脏器提取的DNA 中扩增出2 条核苷酸序列, 用Lasergene v7. 1 DNAStar 软件对拼接后的鹅圆环 …",http://www.cqvip.com/qk/98248a/201004/35263512.html,"万春和， 施少华， 程龙飞， 傅光华， 陈红梅， 黄瑜 - 中国动物传染病学报, 2010 - cqvip.com",2010
ΦC31 整合酶介导的外源基因在牛基因组中整合位点的分析,"… 等动物基因组中实现高效定点整合,染色体上的整合位点称为假attP 位点。据报道在人基因组中
存在着约有100多个假attB 位点,在小鼠基因组中发现约有57个。先前我们在牛基因组中首次发现
了2个假attP 位点,分别位于19号、28号染色体上。为了进一步分析牛基因组中是否分布更多的假…",https://cpfd.cnki.com.cn/Article/CPFDTOTAL-ZGYL200711001143.htm,"欧海龙， 黄英， 曾溢滔 - 遗传学进步与人口健康高峰论坛论文集, 2007 - cpfd.cnki.com.cn",2007
牛血凝块基因组DNA 提取方法的建立,"建立了一种牛血凝块基因组DNA 提取方法, 其过程为机械性粉碎, 高盐EDTA 处理后用含蛋白酶K 和SDS 的细胞裂解液消化, 苯酚-氯仿抽提, 再以本方法抽提的DNA 为模板进行PCR 扩增, 对PCR 产物测序, 测序结果与抗凝血DNA 的PCR 产物测序结果比较 …",http://www.cqvip.com/qk/96405a/200706/26035662.html,"曹岩峰， 李建斌， 王洪梅， 李秋玲， 胡桂学， 仲跻峰 - 中国草食动物, 2007 - cqvip.com",2007
老鹳草基因组DNA 提取及检测,"… 您的位置：网站首页 > 《中文科技期刊数据库》 > 自然科学 > 生物学 > 动物分类学 > 摘要 
老鹳草基因组DNA提取及检测 … 摘要：目的提取老鹤草基因组DNA及检测。方法试剂盒法提取
DNA，琼脂糖凝胶及紫外检测DNA质量。结果所提取的DNA分子量大小在23kb左右，OD260／OD280比值…",http://www.cqvip.com/qk/90435a/200822/28356942.html,"刘娟， 张沙莎， 朱金玲， 张玉萍 - 中小企业管理与科技, 2008 - cqvip.com",2008
绦虫线粒体基因组学研究进展,"… 摘要：绦虫大约有1 500多种,隶属于扁形动物门（Platyhel-minthes）绦虫纲（Cestoda）,营寄生
生活,由成虫及其幼虫（蚴）所致的绦虫病和绦虫蚴病严重危害人和动物的健康。绦虫线粒体基因组
有许多独特的特征如基因组很小,基因位置排列相对稳定等,tRNA和两个主要非编码区的二级结构、…",http://www.cqvip.com/qk/90588a/2011011/39862410.html,"贾万忠， 闫鸿斌， 娄忠子， 倪兴维， 史万贵， 郭爱疆… - 中国预防兽医 …, 2011 - cqvip.com",2011
在人类全基因组范围内研究U2AF 对前体mRNA 剪接的调控机制,"… 研究,但仍有几个极其重要的科学问题未被阐明。首先,U2AF是否负责哺乳动物基因组内所有的
功能性3’剪接位点的识别,或负责识别多大程度的3’… 人类全基因组范围内研究U2AF与RNA的相互
作用关系(CLIP-seq),并结合对RNA-seq和RASL-seq数据分析发现,U2AF负责识别人类基因组中…",https://cdmd.cnki.com.cn/Article/CDMD-10486-1015565970.htm,邵长伟 - 2014 - cdmd.cnki.com.cn,0
真核生物非逆转录病毒内生化与进化基因组学研究,"… 动物基因组中存在了数百万年。特别是在人类和其它哺乳动物的基因组中鉴定出一个类似细小
病毒CP基因的直系同源(orthologous)序列,表明细小病毒与哺乳动物… 另外,通过表达分析证明部分
内源细小病毒基因在真核生物基因组中可以表达,表明细小病毒可能作为宿主未曾预料的遗传革新…",https://cdmd.cnki.com.cn/Article/CDMD-10504-1011405142.htm,刘慧泉 - 2011 - cdmd.cnki.com.cn,0
"棘皮动物线粒体基因组的基因重排, 分子标记及系统发生分析","棘皮动物(echinoderms) 是海洋生境中所特有的无脊椎动物重要类群, 本文全面比较分析了棘皮动物29 个物种的线粒体全基因组. 线粒体基因组主编码基因的分析结果显示, 海胆纲Echinoidea 和海参纲Holothuroidea 物种的基因排列完全相同; 海星纲Asteroidea 物种之间的基因排列也 …",http://www.cqvip.com/qk/95712x/2013005/47784141.html,"申欣， 田美， 孟学平， 程汉良， 阎斌伦 - 海洋学报, 2013 - cqvip.com",2013
线粒体假基因——核基因组中的分子化石,"… 摘要：核基因组中线粒体DNA片段是线粒体基因向核基因组转移造成的.这些线粒体来源的核… 
必然给mtDNA的应用带来负面影响.总结了脊椎动物线粒体假基因的特点,结合笔者在GenBank上发现
… 、脊椎动物系统进化研究等方面应用的负面影响.对假基因在线粒体和细胞核两基因组进化研究…",http://www.cqvip.com/qk/95476x/200502/15800525.html,"刘泽， 邹本玲， 李庆伟 - 辽宁师范大学学报: 自然科学版, 2005 - cqvip.com",2005
后基因组时代中医证候组学研究的思考,"… （动物模型）的 方法。虽然模式生物存在基因组的差异性，而相同的 病理表现应有其相应的共性
基础，在基因组学上，即表 现为相应的基因。人们已成功地运用基因敲出等技术 制作了一些动物… 
相关基因和关键基因并明确其相 互关系后才有可能来制作理想的动物证候模型及评价 药物疗效。 …",http://www.cjim.cn/zxyjhcn/zxyjhcn/ch/reader/create_pdf.aspx?file_no=20010827,王忠， 王永炎， 王阶 - 2001 - cjim.cn,0
宏基因组学及其研究进展,"… 摘要：宏基因组学是近年来发展起来的一门新兴学科,主要技术包括从环境样品中提取微生物混合
基因组DNA、利用可培养的宿主菌建立宏基因组… 新途径。目前宏基因组学已广泛应用于各个领域
,并在医药、农业、能源开发、环境修复、生物技术、生物防御等方面有了较深入的研究。笔者对宏…",http://www.cqvip.com/qk/94317a/201003/33314203.html,"张辉， 崔焕忠 - 中国畜牧兽医, 2010 - cqvip.com",2010
功能基因组学的研究方法,"… 摘要：基因组学的研究已从结构基因组学转向功能基因组学，功能基因组学时代对于基因功能的
研究也由单一基因转向大规模，批量分析，本文综述了功能基因组学的研究内容与方法，主要包括
：差异显示反转录PCR，基因表达序列分析（SAGE），微点阵，遗传足迹法，反求遗传学，蛋白质组…",http://www.cqvip.com/qk/82431x/200204/6597803.html,"师科荣， 王爱国 - 生物技术通讯, 2002 - cqvip.com",2002
中国昆虫基因组学的研究进展,"… 基因组的两倍多,也是迄今为止测序完成 的最大动物基因组.在克服大基因组的天然难度 下,研究
团队公布了scaffold N50 达到320 kb 的 基因组… 转座元件占飞蝗基 因组的60%,是导致飞蝗比
其它昆虫物种基因组 都大的主要原因;同时发现飞蝗发生显著扩张的 基因家族主要参与解毒,化学…",http://159.226.67.71/bitstream/000000/13026/1/%E4%B8%AD%E5%9B%BD%E6%98%86%E8%99%AB%E5%9F%BA%E5%9B%A0%E7%BB%84%E5%AD%A6%E7%9A%84%E7%A0%94%E7%A9%B6%E8%BF%9B%E5%B1%95-4d346b81.pdf,侯丽， 詹帅， 周欣， 李飞， 王宪辉 - 2017 - 159.226.67.71,0
京海黄鸡MyoG 基因密码子特性分析,"… 以及codonW软件对鸡MyoG基因进行分析，并与鸡基因、模式动物基因组和其他动物MyoG基因
进行比较。结果表明，MyoG基因偏好于G/C结尾… 与其他物种基因组密码子偏好性比较结果显示
，密码子偏好性与小鼠差异最小，说明小鼠可以作为MyoG基因外源表达的宿主。与其他动物MyoG…",http://www.cqvip.com/qk/91494x/201404/662519241.html,"张涛， 张跟喜， 韩昆鹏， 王金玉， 樊庆灿， 李婷婷， 段炼… - 华北农学报, 2014 - cqvip.com",2014
圆斑星鲽线粒体基因组全序列结构及其进化,"利用圆斑星鲽(Verasper variegatus Temminck et Schlegel)和相关鱼类的部分线粒体基因序列,设计
出6对扩增引物,通过PCR扩增产物直接测序和引物行走(Primer walking)法测定圆斑星鲽线粒体
基因组全序列,并对其进行结构与进化分析.圆斑星鲽线粒体基因组序列长17273 bp,其基因…",http://www.cqvip.com/qk/98270x/2007004/24835024.html,"赫崇波， 高祥刚， 王效敏， 刘卫东， 周遵春， 木云雷… - 中国水产科学, 2007 - cqvip.com",2007
带属绦虫线粒体基因组全序列生物信息学分析,"… 。从NCBI GenBank中下载已测序的6种带属绦虫线粒体基因组（mt genome）全序列,以细粒棘球
… 2个（包括1个大亚基和1个小亚基）。基因组结构紧凑,基因间存在重叠区域,如nad4L和nad4基因
;… ;线粒体基因组有2个大的非编码区,1个长非编码区（LNR）和1个短非编码区（SNR）;线粒体基因组…",http://www.cqvip.com/qk/93164a/201011/36009442.html,"贾万忠， 闫鸿斌， 史万贵， 王玉朝， 郭爱疆， 詹芳… - 中国兽医学报, 2010 - cqvip.com",2010
鹅圆环病毒浙江永康株全基因组的克隆及序列分析,"… 基因组序列.基因组序列分析表明,浙江永康株GoCV-yk01全长1821bp,具有圆环病毒共同的与
病毒复制相关的茎环结构和Rep蛋白保守基序等特征,它与德国、中国台湾发表的序列在全基因组… 
到了一定的协同作用.该GoCV-yk01是中国内地首次检测确认并测定全基因组序列的鹅圆环病毒. …",http://www.cqvip.com/qk/94144x/200506/20733164.html,"余旭平， 郑新添， 何世成， 朱军莉， 沈琴芳 - 微生物学报, 2005 - cqvip.com",2005
奶牛乳房炎相关基因的功能基因组学研究进展,"… 摘要：功能基因组学是在基因组水平上系统、全面的分析基因的功能,主要研究技术有差异显示
反转录PCR、表达序列标签、基因表达系列分析、微阵列、RNA干涉、蛋白质组学及生物信息学等
.综述了功能基因组学主要研究技术及其在奶牛乳房炎相关基因的表达、抗性候选基因的鉴定、…",http://www.cqvip.com/qk/94944x/200403/9970439.html,"曹随忠， 杜立新， 赵兴绪 - 甘肃农业大学学报, 2004 - cqvip.com",2004
橄榄基因组DNA 提取及RAPD 扩增条件优化,"以橄榄叶片为材料,进行橄榄基因组DNA提取及RAPD扩增条件优化.试验表明,采用改良的SDS法
,提取的DNA质量较高,适宜于RAPD分析.在25μL反应体积中,RAPD反应的优化体系为:18.5μL 
dd H2O,0.5μL dNTP,2.5μl Buffer,1μL引物,0.5μL DNA模板,2μL TaqDNA聚合酶. …",http://www.cqvip.com/qk/96019b/200502/15674151.html,"聂珍素， 赖钟雄， 潘东明， 郭玉琼， 陈义挺， 邓传远… - 亚热带农业研究, 2005 - cqvip.com",2005
小黄鱼(Larimichthys polyactis) 线粒体基因组结构与特征,"… 摘要：采用长片段扩增策略,获得鲈形目石首鱼科黄鱼属小黄鱼的线粒体基因组全序列。组装分析
… ,环区T含量仅为9%,而G含量达45%,这与哺乳动物和爪蟾该区域富含T有所不同。另一个假定发夹
… mtDNA比较进化研究,根据分子钟假说,估计二者线粒体基因组的进化分歧时间为4.8百万年前。 …",http://www.cqvip.com/qk/90072x/201006/37132376.html,"柳淑芳， 吴仁协， 朱玲， 庄志猛 - 海洋与湖沼, 2010 - cqvip.com",2010
我国啮齿目动物携带的指环病毒基因组学特征分析,"近年来新发传染病屡有发生, 全球近75% 的新发传染病是动物源性的. 啮齿目动物作为全球种类最多, 分布最广的哺乳动物种群, 它们与人类密切接触, 是各种新发病毒的自然储库, 可传播60 多种已知的人畜共患传染病. 因此我们对我国啮齿目动物携带的病毒组进行了大规模系统性的 …",https://cdmd.cnki.com.cn/Article/CDMD-10023-1019006557.htm,李玉晖 - 2018 - cdmd.cnki.com.cn,0
动物DVL 蛋白家族的系统演化动态研究,"Wnt 信号通路高度保守, 对细胞命运决定, 迁移, 极性建立, 原始体轴形成和器官的发生以及干细胞的自我更新等起着关键的作用. Dishevelled (DVL) 作为第一个被发现的胞浆蛋白, 是Wnt 信号通路的核心组分, 在Wnt 信号传导通路中都起着重要作用. 通过对不同物种(从单细胞动物到 …",http://www.cqvip.com/qk/97024c/201912/7100942214.html,"刘俊超， 宋晓军 - 基因组学与应用生物学, 2019 - cqvip.com",2019
六株猪圆环病毒2 型国内分离株的全基因组序列测定与分析,"… 摘要：利用PK15细胞从临床发病猪和死亡猪淋巴结中分离到6株猪圆环病毒2型(PCV2),对其全
基因组序列进行了测定和分析.结果表明,除深圳分离株(Sz)的基因组全长为1768 nt外,其余5株均
为1767 nt;6个分离株之间全序列核苷酸同源性为98.08%;与欧、美毒株之间同源性高,介于94.4%…",http://www.cqvip.com/qk/97947x/200501/15045614.html,"王忠田， 郭鑫， 杨汉春， 查振林， 陈艳红 - 农业生物技术学报, 2005 - cqvip.com",2005
双壳贝类线粒体基因组结构的比较,"… ，具有重要的研究 价值。目前，国内外对于脊椎动物线粒体基因组的研究较多，典型脊椎动物
线粒体基因组结 构已被阐明[6]。双壳贝类（Bivalvia）等无脊椎动物线粒体基因组的研究进展迅速
，目前， GenBank中已公开发表的双壳贝类的线粒体基因组全序列共有16种，海产贝类14种，淡水…",http://www.chinagene.cn/CN/abstract/abstract1893.shtml,"赫崇波， 宋文涛， 高祥刚， 刘卫东 - 遗传, 2009 - chinagene.cn",2009
文昌鱼与比较基因组学和分子发育生物学,"… 基因组学研究和发育同源性分析中.文昌鱼独特的进化地位和它未经复制的基因组使其在比较
基因组学中有着无可比拟的优越性,通过对文昌鱼、无脊椎动物和脊椎动物的基因组之间的比较,可以
揭示脊椎动物原始祖先基因组的结构和演化过程进而探索人类的起源.同时,通过对文昌鱼和其它…",http://www.cqvip.com/qk/95761x/200504/20892389.html,"王磊， 宿红艳， 冯培勇， 张士璀 - 海洋湖沼通报, 2005 - cqvip.com",2005
鸡肠道菌基因组DNA 的RAPD 分类的研究,"… 鸡肠道菌基因组DNA的RAPD分类的研究 … 摘要：本文以7种鸡肠道菌为研究对象,分别提取
基因组DNA,利用随机扩增多态性DNA(RAPD)技术对其基因组进行DNA分析,筛选出一系列随机
引物,能在7种肠道细菌中有较好的多态性,可用作分子标记鉴别这7种肠道菌. …",http://www.cqvip.com/qk/91152x/200203/6243304.html,"吴天星， 金勇丰， 曹广力， 张耀洲 - 畜牧兽医学报, 2002 - cqvip.com",2002
病毒宏基因组学的研究现状及应用,"… 摘要：病毒宏基因组学（Metagenomics）是一种新兴的病毒组学研究技术，它突破了传统技术
方法的局限，而直接以环境中所有病毒的遗传物质为… 道、动物组织、血液、水体等，充分显示出其
在病毒发现、病原溯源、微生物预警等方面的实用意义。笔者在本文中简要介绍了病毒宏基因组学的…",http://www.cqvip.com/qk/91152x/201212/44236494.html,"何彪， 涂长春 - 畜牧兽医学报, 2012 - cqvip.com",2012
宏基因组学研究进展,"… 文库对该地区不可培养病毒的多 样性进行分析, 结果发现扩增得到的病毒基因型中 65%为新
的基因型, 其中包含一类海藻病毒, 多数 病毒具有新的基因型, 与节肢动物和高等植物病毒 存在很
大的序列差异性[61]; 2003 年Breitbart等首次 通过构建宏基因组文库对人体排泄物中的未培养病 …",http://202.116.174.104/scaupec/%E5%BE%AE%E7%94%9F%E7%89%A9%E8%B5%84%E6%BA%90%E5%BC%80%E5%8F%91%E4%B8%8E%E5%88%A9%E7%94%A8/%E5%AE%8F%E5%9F%BA%E5%9B%A0%E7%BB%84%E5%AD%A6%E7%A0%94%E7%A9%B6%E8%BF%9B%E5%B1%95.pdf,"黄循柳， 黄仕杰， 郭丽琼， 林俊芳[1 - 微生物学通报, 2009 - 202.116.174.104",2009
三角帆蚌基因组DNA 提取方法的比较研究,"… 摘要：采用4种DNA提取方法（即苯酚法、改进苯酚法、CTAB法和改进ROSE法）提取三角帆蚌
基因组DNA，并对4种方法提取的DNA进行分析；通过限制性酶切和SSR—PCR扩增基因组DNA，并
对扩增产物进行电泳分析。结果表明，4种方法均有较好的提取效果；所提取的DNA能用于进一步…",http://www.cqvip.com/qk/91056x/200804/27858373.html,"刘瑾， 舒妙安 - 水利渔业, 2008 - cqvip.com",2008
中国常见溞属动物线粒体基因组的测定与序列分析,"水溞, 隶属于节肢动物门(Arthropoda), 甲壳纲(Crustacea), 鳃足亚纲(Babchiopoda), 枝角目(Cladocera), 溞科(Daphniidae), 溞属(Daphnia), 是组成微甲壳类浮游动物的一类重要的单系种群, 广泛分布于淡水, 海水和内陆半咸水中. 目前, 我国现存溞属动物10 余种. 其中 …",https://cdmd.cnki.com.cn/Article/CDMD-10373-1016118023.htm,程瑞雪 - 2016 - cdmd.cnki.com.cn,0
鱼类血液基因组DNA 提取方法优化,"… 性质与哺乳动物有 所差别,常见通过裂解白细胞核而获得核酸的提取 哺乳动物全血基因组的方法
… , 导致提取的基因组蛋 白污染严重.有些提取哺乳动物血液基因组的试剂 盒, 对鱼类基因组的提取
… 基因组的试剂盒, 在鱼类上应用时也需做改 进(钟爱华, 2003).因此, 目前已出现针对鱼虾等 动物…",http://gsnydx.tsk.libsou.com/uploads/1/file/public/201609/20160921165226_103h1flxtl.pdf,刘哲， 康鹏天， 柴文琼， 王太， 刘晓敏 - 2009 - gsnydx.tsk.libsou.com,0
后基因组时代的基因工程小鼠,"… 摘要：基因工程小鼠是当今生命科学中集成度最高的综合性研究体系之一,在认识""基因-蛋白质
-生命现象""、制备人类疾病研究的实验动物模型,以及新药开发的评价体系等领域中具有重要作用
.随着生命科学中功能基因组学的兴起和模式生物时代的到来,使得生物医药研究对基因工程小鼠的…",http://www.cqvip.com/qk/91242x/2003002/7453346.html,"胡以平， 曾溢滔 - 第二军医大学学报, 2003 - cqvip.com",2003
